name,datetime,tempmax,tempmin,temp,feelslikemax,feelslikemin,feelslike,dew,humidity,precip,precipprob,precipcover,preciptype,snow,snowdepth,windgust,windspeed,winddir,sealevelpressure,cloudcover,visibility,solarradiation,solarenergy,uvindex,severerisk,sunrise,sunset,moonphase,conditions,description,icon,stations
new delhi,01-01-2020,67.7,38.3,51.8,67.7,38.3,51.7,45.2,81.1,0,0,0,,0,0,14.1,9.2,78.4,1021,28,0.6,156.8,13.5,6,,2020-01-01T07:13:52,2020-01-01T17:35:01,0.19,Partially cloudy,Partly cloudy throughout the day.,fog,"42182099999,42176099999,VIDP,42139099999,42181099999"
new delhi,02-01-2020,71.4,43.1,57.1,71.4,43.1,57.1,48.3,76.6,0,0,0,,0,0,19,5.8,62.8,1020.7,31.1,0.7,154.3,13.2,6,,2020-01-02T07:14:07,2020-01-02T17:35:43,0.23,Partially cloudy,Partly cloudy throughout the day.,fog,"42182099999,42176099999,VIDP,42139099999,42181099999"
new delhi,03-01-2020,71.7,48.4,59.4,71.7,48.4,59.4,51.2,77.6,0,0,0,,0,0,11.4,8.1,89.8,1018.3,32.5,0.9,146.8,12.7,6,,2020-01-03T07:14:21,2020-01-03T17:36:25,0.25,Partially cloudy,Partly cloudy throughout the day.,fog,"42182099999,42176099999,VIDP,42139099999,42181099999"
new delhi,04-01-2020,70.5,48.7,57.7,70.5,48.7,57.7,50.2,78.3,0,0,0,,0,0,11.2,9.2,280.7,1017.5,24.7,0.7,144.9,12.6,6,,2020-01-04T07:14:34,2020-01-04T17:37:08,0.29,Partially cloudy,Clearing in the afternoon.,fog,"42182099999,42176099999,VIDP,42139099999,42181099999,VIDD"
new delhi,05-01-2020,68.7,47.3,57.5,68.7,47.3,57.5,48.1,73.4,0,0,0,,0,0,16.1,10.3,272.8,1017.9,44.1,1,163,14.2,6,,2020-01-05T07:14:45,2020-01-05T17:37:52,0.32,Partially cloudy,Partly cloudy throughout the day.,partly-cloudy-day,"42182099999,42176099999,VIDP,42139099999,42181099999"
new delhi,06-01-2020,66.2,51.8,57.9,66.2,51.8,57.9,50,77,0,0,0,,0,0,13,8.1,20.5,1018.8,68.7,0.8,93.1,8.2,4,,2020-01-06T07:14:54,2020-01-06T17:38:36,0.35,Partially cloudy,Partly cloudy throughout the day.,fog,"42182099999,42176099999,VIDP,42139099999,42181099999,VIDD"
new delhi,07-01-2020,64.4,55.4,59.3,64.4,55.4,59.3,54.2,83.8,0.146,100,4.17,rain,0,0,16.1,9.2,92.9,1016.3,70.5,1,100.4,8.7,5,,2020-01-07T07:15:02,2020-01-07T17:39:22,0.39,"Rain, Partially cloudy",Partly cloudy throughout the day with late afternoon rain.,rain,"42182099999,42176099999,VIDP,42139099999,42181099999"
new delhi,08-01-2020,57.7,51.8,55.5,57.7,51.8,55.5,54.1,95,0.697,100,12.5,rain,0,0,17.9,11.4,336.1,1014.5,77.1,0.7,56,4.8,3,,2020-01-08T07:15:09,2020-01-08T17:40:07,0.42,"Rain, Partially cloudy",Partly cloudy throughout the day with rain clearing later.,rain,"42182099999,42176099999,VIDP,42139099999,42181099999"
new delhi,09-01-2020,57.7,46.4,51.6,57.7,43.7,50.3,48.1,89,0,0,0,,0,0,20.4,10.3,286.3,1019.3,39.3,0.7,172.8,15,6,,2020-01-09T07:15:13,2020-01-09T17:40:54,0.45,Partially cloudy,Partly cloudy throughout the day.,fog,"42182099999,42176099999,VIDP,42139099999,42181099999,remote"
new delhi,10-01-2020,62.9,42.8,51.3,62.9,38.5,50.1,46.1,84.4,0,0,0,,0,0,18.6,9.2,274.9,1019.9,31.9,0.5,177.3,15.3,7,,2020-01-10T07:15:17,2020-01-10T17:41:41,0.48,Partially cloudy,Clearing in the afternoon.,fog,"42182099999,42176099999,VIDP,42139099999,42181099999,remote"
new delhi,11-01-2020,66.4,44.1,53.7,66.4,43.5,53.4,45.5,77,0,0,0,,0,0,15,9.2,262.6,1019.4,29.6,1.1,155.9,13.4,7,,2020-01-11T07:15:18,2020-01-11T17:42:28,0.5,Partially cloudy,Partly cloudy throughout the day.,partly-cloudy-day,"42182099999,42176099999,VIDP,42139099999,42181099999"
new delhi,12-01-2020,71.5,46.6,56.9,71.5,45.6,56.7,47.7,75,0,0,0,,0,0,13.6,8.1,259.9,1016.2,23.9,0.9,172.5,14.9,7,,2020-01-12T07:15:18,2020-01-12T17:43:16,0.55,Partially cloudy,Partly cloudy throughout the day.,fog,"42182099999,42176099999,VIDP,42139099999,42181099999"
new delhi,13-01-2020,69.8,48.9,59,69.8,48.9,59,52.3,80.2,0.032,100,4.17,rain,0,0,23.3,11.9,131.3,1011.5,56.9,0.8,135.8,11.7,6,,2020-01-13T07:15:17,2020-01-13T17:44:05,0.59,"Rain, Partially cloudy",Partly cloudy throughout the day with late afternoon rain.,rain,"42182099999,42176099999,VIDP,42139099999,42181099999,VIDD,remote"
new delhi,14-01-2020,61.2,50,56,61.2,47.7,55.9,52.9,89.7,0,0,0,,0,0,12.5,8.1,312.9,1015.4,35.3,0.9,92.2,8,4,,2020-01-14T07:15:13,2020-01-14T17:44:53,0.62,Partially cloudy,Partly cloudy throughout the day.,fog,"42182099999,42176099999,VIDP,42139099999,42181099999,VIDD"
new delhi,15-01-2020,67,46.4,55.7,67,45.6,55.7,50.9,85.2,0,0,0,,0,0,13,6.9,320.7,1016.2,30,0.9,163.7,14.2,6,,2020-01-15T07:15:08,2020-01-15T17:45:42,0.66,Partially cloudy,Partly cloudy throughout the day.,fog,"42182099999,42176099999,VIDP,42139099999,42181099999"
new delhi,16-01-2020,59.8,46.4,54,59.8,44.2,53.8,51.2,90.3,0.159,100,16.67,rain,0,0,22.4,6.9,315.6,1015.3,63.2,0.6,112.4,9.8,5,,2020-01-16T07:15:02,2020-01-16T17:46:32,0.69,"Rain, Partially cloudy",Partly cloudy throughout the day with rain.,rain,"42182099999,42176099999,VIDP,42139099999,42181099999"
new delhi,17-01-2020,62.6,52.3,55.4,62.6,52.3,55.4,52.8,91.5,0.047,100,8.33,rain,0,0,14.1,8.1,292.9,1016.4,63.1,0.6,117.5,10.2,5,,2020-01-17T07:14:54,2020-01-17T17:47:21,0.75,"Rain, Partially cloudy",Partly cloudy throughout the day with early morning rain.,rain,"42182099999,42176099999,VIDP,42139099999,42181099999"
new delhi,18-01-2020,62.2,50.7,54.6,62.2,50.7,54.6,50.9,88.3,0,0,0,,0,0,12.8,6.9,297.3,1018.3,47.9,0.5,119.8,10.5,5,,2020-01-18T07:14:44,2020-01-18T17:48:11,0.76,Partially cloudy,Clearing in the afternoon.,fog,"42182099999,42176099999,VIDP,42139099999,42181099999"
new delhi,19-01-2020,60.7,46.1,50.9,60.7,41.1,49,48.4,92.1,0,0,0,,0,0,16.8,10.4,266.2,1019.2,27.8,0.5,172.4,14.8,7,,2020-01-19T07:14:33,2020-01-19T17:49:01,0.8,Partially cloudy,Clearing in the afternoon.,fog,"42182099999,42176099999,VIDP,42139099999,42181099999"
new delhi,20-01-2020,59.8,46.4,51.9,59.8,42.9,50.6,50.4,94.7,0,0,0,,0,0,14.8,8.1,268.4,1018.1,50.1,0.5,148.6,12.9,6,,2020-01-20T07:14:20,2020-01-20T17:49:52,0.84,Partially cloudy,Partly cloudy throughout the day.,fog,"42182099999,42176099999,VIDP,42139099999,42181099999"
new delhi,21-01-2020,67.7,50.5,56.5,67.7,50.5,56.5,52.5,87.8,0,0,0,,0,0,11.4,6.9,104.2,1018.5,54.5,0.5,170.1,14.6,7,,2020-01-21T07:14:06,2020-01-21T17:50:42,0.87,Partially cloudy,Partly cloudy throughout the day.,fog,"42182099999,42176099999,VIDP,42139099999,42181099999"
new delhi,22-01-2020,62.3,46.7,53,62.3,45.6,52.5,50.9,92.8,0,0,0,,0,0,17.4,9.2,262,1020.6,47.2,0.4,182.3,15.7,7,,2020-01-22T07:13:49,2020-01-22T17:51:32,0.91,Partially cloudy,Clearing in the afternoon.,fog,"42182099999,42176099999,VIDP,42139099999,42181099999"
new delhi,23-01-2020,67.8,48.2,55.7,67.8,44.5,54.7,44.8,70.5,0,0,0,,0,0,23.3,11.7,275.3,1018.8,9.6,1.4,191.7,16.6,7,,2020-01-23T07:13:32,2020-01-23T17:52:23,0.94,Clear,Clear conditions throughout the day.,clear-day,"42182099999,42176099999,VIDP,42139099999,42181099999"
new delhi,24-01-2020,68.8,42.8,55.4,68.8,38,54.2,42.9,66.4,0,0,0,,0,0,22.4,13.9,267.9,1016.3,23.8,1.7,193.5,16.6,7,,2020-01-24T07:13:13,2020-01-24T17:53:13,0.98,Partially cloudy,Partly cloudy throughout the day.,partly-cloudy-day,"42182099999,42176099999,VIDP,42139099999,42181099999"
new delhi,25-01-2020,67.5,44.1,56.1,67.5,44.1,56.1,44.8,69.4,0,0,0,,0,0,11.9,7.6,286.4,1016.5,16,1.4,188.8,16.4,7,,2020-01-25T07:12:52,2020-01-25T17:54:03,0,Clear,Clear conditions throughout the day.,clear-day,"42182099999,42176099999,VIDP,42139099999,42181099999"
new delhi,26-01-2020,72.3,45.9,57.5,72.3,45.9,57.5,47.8,73.9,0,0,0,,0,0,16.6,9.2,274.7,1014.8,8.1,0.9,185.4,16.1,7,,2020-01-26T07:12:30,2020-01-26T17:54:54,0.04,Clear,Clear conditions throughout the day.,fog,"42182099999,42176099999,VIDP,42139099999,42181099999"
new delhi,27-01-2020,71.6,50.2,60.3,71.6,50.2,60.3,50.6,72.9,0,0,0,,0,0,13.9,10.3,57,1012.1,47.1,0.9,139.2,12,6,,2020-01-27T07:12:06,2020-01-27T17:55:44,0.08,Partially cloudy,Partly cloudy throughout the day.,fog,"42182099999,42176099999,VIDP,42139099999,42181099999"
new delhi,28-01-2020,70.6,55.4,60.5,70.6,55.4,60.5,56.7,88.2,0.349,100,25,rain,0,0,22.4,13.9,90.4,1010.7,73,0.9,134.6,11.5,5,,2020-01-28T07:11:40,2020-01-28T17:56:34,0.11,"Rain, Partially cloudy",Partly cloudy throughout the day with rain.,rain,"42182099999,42176099999,VIDP,42139099999,42181099999"
new delhi,29-01-2020,68.3,51.8,58.5,68.3,51.8,58.5,52.7,83.4,0.182,100,4.17,rain,0,0,13.2,8.6,311,1016.7,46.6,1,150.7,13,7,,2020-01-29T07:11:14,2020-01-29T17:57:24,0.14,"Rain, Partially cloudy",Partly cloudy throughout the day with early morning rain.,rain,"42182099999,42176099999,VIDP,42139099999,42181099999"
new delhi,30-01-2020,67.1,48.2,57.2,67.1,45,57,51.2,82.4,0,0,0,,0,0,22.1,11.4,285.5,1017.7,6.5,0.9,189.1,16.2,7,,2020-01-30T07:10:45,2020-01-30T17:58:14,0.17,Clear,Clear conditions throughout the day.,fog,"42182099999,42176099999,VIDP,42139099999,42181099999"
new delhi,31-01-2020,66.2,44.6,54.3,66.2,41.3,53.7,47.7,80.6,0,0,0,,0,0,16.6,8.2,277.7,1015.5,6.2,1.3,188.5,16.3,7,,2020-01-31T07:10:16,2020-01-31T17:59:04,0.21,Clear,Clear conditions throughout the day.,clear-day,"42182099999,42176099999,VIDP,42139099999,42181099999"
new delhi,01-02-2020,66.6,45.2,55.3,66.6,45.2,55.2,47.4,76.5,0,0,0,,0,0,16.8,9.2,295.5,1018.3,21.2,1.1,186.7,16.1,7,,2020-02-01T07:09:44,2020-02-01T17:59:53,0.24,Partially cloudy,Partly cloudy throughout the day.,partly-cloudy-day,"42182099999,42176099999,VIDP,42139099999,42181099999"
new delhi,02-02-2020,65.7,44.6,53.7,65.7,41.3,53.4,47.2,80.9,0,0,0,,0,0,18.8,11.4,276.6,1019.8,33.8,0.8,202.1,17.5,7,,2020-02-02T07:09:12,2020-02-02T18:00:42,0.25,Partially cloudy,Clearing in the afternoon.,fog,"42182099999,42176099999,VIDP,42139099999,42181099999"
new delhi,03-02-2020,69.8,43.9,56.5,69.8,43.2,56.3,45.1,70.7,0,0,0,,0,0,15.2,7.9,266,1018.5,0,1.3,204.5,17.7,7,,2020-02-03T07:08:38,2020-02-03T18:01:31,0.3,Clear,Clear conditions throughout the day.,clear-day,"42182099999,42176099999,VIDP,42139099999,42181099999"
new delhi,04-02-2020,70.9,45.1,58.2,70.9,45.1,58.2,46.3,68.3,0,0,0,,0,0,14.8,9.2,120.7,1016.8,8.1,1.1,200.8,17.4,7,,2020-02-04T07:08:03,2020-02-04T18:02:20,0.34,Clear,Clear conditions throughout the day.,clear-day,"42182099999,42176099999,VIDP,42139099999,42181099999"
new delhi,05-02-2020,69.8,47.2,57.7,69.8,46.2,57.5,48.9,75.2,0,0,0,,0,0,18.3,10.3,287,1017.1,19.3,1.1,197.6,17,7,,2020-02-05T07:07:26,2020-02-05T18:03:08,0.37,Clear,Clear conditions throughout the day.,clear-day,"42182099999,42176099999,VIDP,42139099999,42181099999,remote"
new delhi,06-02-2020,66.2,45.3,55.3,66.2,44.2,55,46.3,75.4,0,0,0,,0,0,14.3,6.9,265.7,1016.4,14.9,1.3,206,17.8,7,,2020-02-06T07:06:48,2020-02-06T18:03:56,0.4,Clear,Clear conditions throughout the day.,clear-day,"42182099999,42176099999,VIDP,42139099999,42181099999"
new delhi,07-02-2020,66.9,45,55.5,66.9,45,55.5,46.6,74.2,0,0,0,,0,0,18.1,9.2,309.7,1018.9,3.9,1,183,16,7,,2020-02-07T07:06:08,2020-02-07T18:04:44,0.43,Clear,Clear conditions throughout the day.,clear-day,"42182099999,42176099999,VIDP,42139099999,42181099999,remote"
new delhi,08-02-2020,69.1,47.5,56.6,69.1,46.3,56.3,47.3,74.1,0,0,0,,0,0,16.1,11.4,286.2,1020.8,2.1,1,209.5,18,8,,2020-02-08T07:05:28,2020-02-08T18:05:31,0.47,Clear,Clear conditions throughout the day.,clear-day,"42182099999,42176099999,VIDP,42139099999,42181099999"
new delhi,09-02-2020,71.4,45.9,57.6,71.4,45.9,57.5,48.4,75.3,0,0,0,,0,0,13.9,38.9,305.5,1021.3,19.3,1,212.6,18.4,8,,2020-02-09T07:04:46,2020-02-09T18:06:18,0.5,Clear,Clear conditions throughout the day.,wind,"42182099999,42176099999,VIDP,42139099999,42181099999"
new delhi,10-02-2020,69.5,44.6,56.1,69.5,43.2,55.9,47.3,75.1,0,0,0,,0,0,16.1,8.1,269.2,1019.3,29.9,0.8,215,18.6,8,,2020-02-10T07:04:03,2020-02-10T18:07:05,0.53,Partially cloudy,Partly cloudy throughout the day.,fog,"42182099999,42176099999,VIDP,42139099999,42181099999"
new delhi,11-02-2020,72.3,45.4,58.7,72.3,45.4,58.7,48,72.1,0,0,0,,0,0,14.3,6.9,275.4,1019.4,11.8,0.9,215.5,18.6,8,,2020-02-11T07:03:18,2020-02-11T18:07:51,0.57,Clear,Clear conditions throughout the day.,fog,"42182099999,42176099999,VIDP,42139099999,42181099999"
new delhi,12-02-2020,75.2,50,61,75.2,48.4,60.9,52.5,76.8,0,0,0,,0,0,24.2,13.9,264.9,1018.8,11.4,0.8,210.6,18.1,8,,2020-02-12T07:02:33,2020-02-12T18:08:37,0.6,Clear,Clear conditions throughout the day.,fog,"42182099999,42176099999,VIDP,42139099999,42181099999"
new delhi,13-02-2020,80.9,51.8,65.7,81.5,51.8,65.7,53.3,67.5,0,0,0,,0,0,23.9,13.9,261.7,1015.7,4.1,1.3,211.8,18.1,8,,2020-02-13T07:01:46,2020-02-13T18:09:23,0.64,Clear,Clear conditions throughout the day.,clear-day,"42182099999,42176099999,VIDP,42139099999,42181099999"
new delhi,14-02-2020,76.1,55.5,65.4,76.1,55.5,65.4,50.4,60.7,0,0,0,,0,0,29.8,16.1,278.9,1012.9,0,1.4,222.2,19.1,8,,2020-02-14T07:00:58,2020-02-14T18:10:08,0.67,Clear,Clear conditions throughout the day.,clear-day,"42182099999,42176099999,VIDP,42139099999,42181099999"
new delhi,15-02-2020,77,50,63.4,77,47.2,63.2,46.2,56.7,0,0,0,,0,0,23.5,16.1,264.5,1013.2,0,1.5,225.5,19.6,8,,2020-02-15T07:00:09,2020-02-15T18:10:53,0.71,Clear,Clear conditions throughout the day.,clear-day,"42182099999,42176099999,VIDP,42139099999,42181099999"
new delhi,16-02-2020,79.1,51,64.1,79.1,51,64.1,48.5,60.5,0,0,0,,0,0,16.6,9.2,283.2,1016.3,0,1.5,226.6,19.7,8,,2020-02-16T06:59:19,2020-02-16T18:11:37,0.75,Clear,Clear conditions throughout the day.,clear-day,"42182099999,42176099999,VIDP,42139099999,42181099999"
new delhi,17-02-2020,78.8,51.1,63.4,78.8,51.1,63.4,49.2,65.2,0,0,0,,0,0,20.1,13.9,272.7,1017.4,1.8,1.3,227.1,19.7,8,,2020-02-17T06:58:28,2020-02-17T18:12:21,0.78,Clear,Clear conditions throughout the day.,clear-day,"42182099999,42176099999,VIDP,42139099999,42181099999"
new delhi,18-02-2020,77.3,51.8,64,77.3,51.8,64,46.1,56,0,0,0,,0,0,21.5,12.8,269.5,1014.6,5.2,1.3,230.6,19.8,8,,2020-02-18T06:57:36,2020-02-18T18:13:05,0.81,Clear,Clear conditions throughout the day.,clear-day,"42182099999,42176099999,VIDP,42139099999,42181099999"
new delhi,19-02-2020,79,49.3,66,79,49.3,66,49.8,60.1,0,0,0,,0,0,21.7,13.9,111.9,1013.2,45.4,1.4,202.9,17.7,7,,2020-02-19T06:56:43,2020-02-19T18:13:48,0.85,Partially cloudy,Partly cloudy throughout the day.,partly-cloudy-day,"42182099999,42176099999,VIDP,42139099999,42181099999,VIDD,remote"
new delhi,20-02-2020,80.6,59.1,69.2,81.1,59.1,69.2,54.5,61.2,0.039,100,4.17,rain,0,0,28.9,15,102.7,1012.7,54.9,1.6,214,18.5,8,,2020-02-20T06:55:49,2020-02-20T18:14:31,0.88,"Rain, Partially cloudy",Partly cloudy throughout the day with late afternoon rain.,rain,"42182099999,42176099999,VIDP,42139099999,42181099999,VIDD"
new delhi,21-02-2020,68.1,57.2,62.9,68.1,57.2,62.9,57.4,82.7,0,0,0,,0,0,28.9,17.2,61.8,1016.6,67.1,1.8,57.4,5,3,,2020-02-21T06:54:54,2020-02-21T18:15:13,0.92,Partially cloudy,Partly cloudy throughout the day.,partly-cloudy-day,"42182099999,42176099999,VIDP,42139099999,42181099999"
new delhi,22-02-2020,75.5,55.4,64.3,75.5,55.4,64.3,56.7,78.3,0,0,0,,0,0,15.7,9.2,56.6,1020.1,45.9,1.4,148.7,13,6,,2020-02-22T06:53:58,2020-02-22T18:15:55,0.95,Partially cloudy,Partly cloudy throughout the day.,partly-cloudy-day,"42182099999,42176099999,VIDP,42139099999,42181099999"
new delhi,23-02-2020,79.7,57.7,68.1,79.7,57.7,68.1,58.9,75.2,0,0,0,,0,0,13.9,9.2,324.9,1018,39.9,1.2,198.8,17.2,7,,2020-02-23T06:53:01,2020-02-23T18:16:37,0,Partially cloudy,Partly cloudy throughout the day.,partly-cloudy-day,"42182099999,42176099999,VIDP,42139099999,42181099999"
new delhi,24-02-2020,78.5,57,67.4,78.5,57,67.4,57.1,71.7,0,0,0,,0,0,14.1,8.1,303.5,1014.7,17,1.5,208.3,18.1,8,,2020-02-24T06:52:03,2020-02-24T18:17:18,0.02,Clear,Clear conditions throughout the day.,clear-day,"42182099999,42176099999,VIDP,42139099999,42181099999"
new delhi,25-02-2020,78.2,57.2,66.8,78.2,57.2,66.8,57.7,75.8,0,0,0,,0,0,16.3,11.4,280.9,1013.5,6,1,225.2,19.6,8,,2020-02-25T06:51:05,2020-02-25T18:17:58,0.05,Clear,Clear conditions throughout the day.,clear-day,"42182099999,42176099999,VIDP,42139099999,42181099999"
new delhi,26-02-2020,80.4,57.6,68.6,80.9,57.6,68.6,57.1,70.6,0,0,0,,0,0,12.8,9,272.8,1014,16.4,1,222,19.1,8,,2020-02-26T06:50:06,2020-02-26T18:18:39,0.09,Clear,Clear conditions throughout the day.,clear-day,"42182099999,42176099999,VIDP,42139099999,42181099999"
new delhi,27-02-2020,80.6,58.8,69.2,82,58.8,69.3,61,77.7,0,0,0,,0,0,12.1,8.1,111.6,1014.5,38,0.9,211.4,18.2,8,,2020-02-27T06:49:06,2020-02-27T18:19:19,0.12,Partially cloudy,Partly cloudy throughout the day.,fog,"42182099999,42176099999,VIDP,42139099999,42181099999,remote"
new delhi,28-02-2020,78.8,64.2,70.3,78.8,64.2,70.3,61.9,76.4,0,0,0,,0,0,20.8,12.8,109.9,1013,47.2,1.2,185.9,16.2,7,,2020-02-28T06:48:05,2020-02-28T18:19:58,0.15,Partially cloudy,Partly cloudy throughout the day.,partly-cloudy-day,"42182099999,42176099999,VIDP,42139099999,42181099999"
new delhi,29-02-2020,80.6,60.8,68.4,82.9,60.8,68.5,61.3,80.2,0.737,100,8.33,rain,0,0,22.1,15,90.7,1012.2,66,1.3,144.3,12.4,7,,2020-02-29T06:47:03,2020-02-29T18:20:38,0.19,"Rain, Partially cloudy",Partly cloudy throughout the day with rain.,rain,"42182099999,42176099999,VIDP,42139099999,42181099999"
new delhi,01-03-2020,80,59,69,82.1,59,69.1,59.5,74.3,0,0,0,,0,0,15.2,12.8,112.3,1013,30.8,1.6,201,17.4,8,,2020-03-01T06:46:01,2020-03-01T18:21:16,0.22,Partially cloudy,Partly cloudy throughout the day.,partly-cloudy-day,"42182099999,42176099999,VIDP,42139099999,42181099999"
new delhi,02-03-2020,82.4,61.2,70.6,83.2,61.2,70.6,61.3,75.1,0,0,0,,0,0,10.1,8.1,272.5,1012.7,33.2,1.2,224.7,19.3,8,,2020-03-02T06:44:58,2020-03-02T18:21:55,0.25,Partially cloudy,Partly cloudy throughout the day.,partly-cloudy-day,"42182099999,42176099999,VIDP,42139099999,42181099999"
new delhi,03-03-2020,83,60.2,71.2,82.3,60.2,71.1,58,67.3,0,0,0,,0,0,13.9,8.1,288.5,1011.2,27,1.3,233.2,20.1,8,,2020-03-03T06:43:55,2020-03-03T18:22:33,0.25,Partially cloudy,Partly cloudy throughout the day.,partly-cloudy-day,"42182099999,42176099999,VIDP,42139099999,42181099999"
new delhi,04-03-2020,83.5,60.9,70,85,60.9,70,57.3,66.9,0,0,0,,0,0,20.8,13.5,120.6,1010.2,34,1.5,212.9,18.5,8,,2020-03-04T06:42:51,2020-03-04T18:23:11,0.32,Partially cloudy,Becoming cloudy in the afternoon.,partly-cloudy-day,"42182099999,42176099999,VIDP,42139099999,42181099999"
new delhi,05-03-2020,79.7,59,67.1,79.7,59,67.1,59,77.4,0.62,100,12.5,rain,0,0,25.7,15,100.1,1010.3,74.5,1.5,211.8,18.4,8,,2020-03-05T06:41:46,2020-03-05T18:23:48,0.35,"Rain, Partially cloudy",Partly cloudy throughout the day with rain.,rain,"42182099999,42176099999,VIDP,42139099999,42181099999,remote"
new delhi,06-03-2020,70.2,55.4,60.9,70.2,55.4,60.9,56.9,87.6,1.108,100,16.67,rain,0,0,30,11.4,89,1009.3,72.6,1.2,111.5,9.8,6,,2020-03-06T06:40:41,2020-03-06T18:24:26,0.39,"Rain, Partially cloudy",Partly cloudy throughout the day with rain.,rain,"42182099999,42176099999,VIDP,42139099999,42181099999"
new delhi,07-03-2020,69.4,57.2,63,69.4,57.2,63,58.1,85.1,0,0,0,,0,0,18.1,9.2,123.2,1013.8,62.2,1.4,179.1,15.5,7,,2020-03-07T06:39:36,2020-03-07T18:25:03,0.42,Partially cloudy,Partly cloudy throughout the day.,partly-cloudy-day,"42182099999,42176099999,VIDP,42139099999,42181099999"
new delhi,08-03-2020,77,56,64.8,77,56,64.8,56.4,77.3,3.608,100,4.17,rain,0,0,18.6,13.9,298.6,1016,24.3,1.3,238.9,20.6,9,,2020-03-08T06:38:30,2020-03-08T18:25:39,0.45,"Rain, Partially cloudy",Partly cloudy throughout the day with morning rain.,rain,"42182099999,42176099999,VIDP,42139099999,42181099999,remote"
new delhi,09-03-2020,77,56.9,65.5,77,56.9,65.5,53.8,69.7,0,0,0,,0,0,22.1,13.9,281.1,1013.2,6.1,1.7,262.7,22.6,9,,2020-03-09T06:37:23,2020-03-09T18:26:15,0.5,Clear,Clear conditions throughout the day.,clear-day,"42182099999,42176099999,VIDP,42139099999,42181099999,VIDD,remote"
new delhi,10-03-2020,78,54,66.7,78,54,66.7,53.6,66.5,0.015,100,4.17,rain,0,0,11,6.9,147.5,1011.9,21.9,1.5,255.5,22.2,9,,2020-03-10T06:36:16,2020-03-10T18:26:51,0.52,"Rain, Partially cloudy",Partly cloudy throughout the day with late afternoon rain.,rain,"42182099999,42176099999,VIDP,42139099999,42181099999"
new delhi,11-03-2020,80.4,61.6,70.2,82.2,61.6,70.2,60.4,73.2,0.041,100,8.33,rain,0,0,23.7,15,106.8,1009.3,56.4,1.7,207.5,17.9,8,,2020-03-11T06:35:09,2020-03-11T18:27:27,0.55,"Rain, Partially cloudy",Clearing in the afternoon with rain.,rain,"42182099999,42176099999,VIDP,42139099999,42181099999"
new delhi,12-03-2020,80.6,61.1,71,80.8,61.1,71,57.5,67,0,0,0,,0,0,23,11.4,137.8,1011.5,51.8,1.8,237.2,20.4,8,,2020-03-12T06:34:01,2020-03-12T18:28:03,0.59,Partially cloudy,Partly cloudy throughout the day.,partly-cloudy-day,"42182099999,42176099999,VIDP,42139099999,42181099999"
new delhi,13-03-2020,82,59,70.1,81,59,70,51.1,54.7,0,0,0,,0,0,20.4,9.2,241.8,1013.4,26,1.7,257.6,22.2,9,,2020-03-13T06:32:53,2020-03-13T18:28:38,0.62,Partially cloudy,Partly cloudy throughout the day.,partly-cloudy-day,"42182099999,42176099999,VIDP,42139099999,42181099999"
new delhi,14-03-2020,74.1,60.7,65.5,74.1,60.7,65.5,60.5,84.6,1.352,100,8.33,rain,0,0,20.1,11.4,70.1,1015,55.3,1.5,161.3,13.9,6,,2020-03-14T06:31:45,2020-03-14T18:29:13,0.65,"Rain, Partially cloudy",Partly cloudy throughout the day with rain.,rain,"42182099999,42176099999,VIDP,42139099999,42181099999,remote"
new delhi,15-03-2020,76.6,55.4,65.5,76.6,55.4,65.5,55.4,73.2,0,0,0,,0,0,11.4,8.1,320.5,1016.4,41.2,1.3,209.4,18.1,7,,2020-03-15T06:30:37,2020-03-15T18:29:48,0.69,Partially cloudy,Partly cloudy throughout the day.,partly-cloudy-day,"42182099999,42176099999,VIDP,42139099999,42181099999"
new delhi,16-03-2020,78.7,57.4,67.9,78.7,57.4,67.9,56.3,69.1,0,0,0,,0,0,15.9,9,280.7,1016.4,36.9,1.5,248,21.3,8,,2020-03-16T06:29:28,2020-03-16T18:30:23,0.75,Partially cloudy,Partly cloudy throughout the day.,partly-cloudy-day,"42182099999,42176099999,VIDP,42139099999,42181099999"
new delhi,17-03-2020,81.3,57.2,70,81.6,57.2,70,56.7,66.5,0,0,0,,0,0,18.6,11.4,285.1,1016.1,0,1.7,270.2,23.3,9,,2020-03-17T06:28:19,2020-03-17T18:30:57,0.76,Clear,Clear conditions throughout the day.,clear-day,"42182099999,42176099999,VIDP,42139099999,42181099999"
new delhi,18-03-2020,84.3,59,72.1,84,59,72,58.4,65.9,0,0,0,,0,0,17.4,11.4,271.7,1014.5,9.3,1.5,265.8,23,9,,2020-03-18T06:27:10,2020-03-18T18:31:32,0.79,Clear,Clear conditions throughout the day.,clear-day,"42182099999,42176099999,VIDP,42139099999,42181099999"
new delhi,19-03-2020,86,60.8,74.2,86,60.8,74.3,61.2,66.8,0,0,0,,0,0,17.2,9.2,290.3,1011.2,22.8,1.5,257.6,22.3,9,,2020-03-19T06:26:00,2020-03-19T18:32:06,0.83,Partially cloudy,Partly cloudy throughout the day.,partly-cloudy-day,"42182099999,42176099999,VIDP,42139099999,42181099999"
new delhi,20-03-2020,87.5,62.6,75.4,90.6,62.6,75.7,61.1,63.2,0,0,0,,0,0,14.3,6.9,90.5,1010,37.9,1.4,241.7,20.8,9,,2020-03-20T06:24:51,2020-03-20T18:32:40,0.86,Partially cloudy,Partly cloudy throughout the day.,partly-cloudy-day,"42182099999,42176099999,VIDP,42139099999,42181099999"
new delhi,21-03-2020,86,66.7,76.4,87.3,66.7,76.5,60.1,59,0,0,0,,0,0,19.5,8.1,290.8,1010.5,46.6,1.7,248.8,21.5,9,,2020-03-21T06:23:41,2020-03-21T18:33:14,0.89,Partially cloudy,Partly cloudy throughout the day.,partly-cloudy-day,"42182099999,42176099999,VIDP,42139099999,42181099999"
new delhi,22-03-2020,86.7,62.6,75.8,86.8,62.6,75.8,60,61.5,0,0,0,,0,0,17,9.2,298.3,1012.4,15.9,1.7,267.4,23,9,,2020-03-22T06:22:32,2020-03-22T18:33:48,0.93,Clear,Clear conditions throughout the day.,clear-day,"42182099999,42176099999,VIDP,42139099999,42181099999,remote"
new delhi,23-03-2020,89.5,64.4,76.6,89.3,64.4,76.2,58,56.8,0,0,0,,0,0,10.3,5.8,269.7,1012,31.5,1.6,266.8,23,9,,2020-03-23T06:21:22,2020-03-23T18:34:21,0.96,Partially cloudy,Partly cloudy throughout the day.,partly-cloudy-day,"42182099999,42176099999,VIDP,42139099999,42181099999"
new delhi,24-03-2020,90.9,67,75.3,94.8,67,75.4,60.7,62.7,0.028,100,4.17,rain,0,0,28.9,17.2,140.1,1010.5,56.4,1.7,217.6,18.8,9,,2020-03-24T06:20:12,2020-03-24T18:34:55,0,"Rain, Partially cloudy",Partly cloudy throughout the day with afternoon rain.,rain,"42182099999,42176099999,VIDP,42139099999,42181099999"
new delhi,25-03-2020,90.9,64.4,76,92.2,64.4,76,61.4,64.7,0,0,0,,0,0,17.9,9.2,302.1,1011.1,38.2,1.9,255.4,22.1,9,,2020-03-25T06:19:03,2020-03-25T18:35:28,0.03,Partially cloudy,Partly cloudy throughout the day.,partly-cloudy-day,"42182099999,42176099999,VIDP,42139099999,42181099999"
new delhi,26-03-2020,82.2,68,74.7,83.9,68,74.9,62.8,67.8,0,0,0,,0,0,20.8,12.8,273.4,1012.3,59.2,1.5,165.8,14.4,6,,2020-03-26T06:17:53,2020-03-26T18:36:02,0.06,Partially cloudy,Partly cloudy throughout the day.,partly-cloudy-day,"42182099999,42176099999,VIDP,42139099999,42181099999"
new delhi,27-03-2020,78.4,64.4,70,78.4,64.4,70,61.7,76.2,0.229,100,12.5,rain,0,0,18.8,11.4,145.2,1014,63.7,1.6,151.1,13,6,,2020-03-27T06:16:43,2020-03-27T18:36:35,0.1,"Rain, Partially cloudy",Partly cloudy throughout the day with rain.,rain,"42182099999,42176099999,VIDP,42139099999,42181099999"
new delhi,28-03-2020,82.4,62.7,71.7,81.7,62.7,71.7,59.8,69.3,0,0,0,,0,0,19.2,11.4,304.4,1014.6,22,1.7,277.7,23.8,9,,2020-03-28T06:15:34,2020-03-28T18:37:08,0.13,Partially cloudy,Partly cloudy throughout the day.,partly-cloudy-day,"42182099999,42176099999,VIDP,42139099999,42181099999"
new delhi,29-03-2020,85.6,62.6,74.3,83.9,62.6,74,56.9,58,0,0,0,,0,0,23.9,12.8,303.3,1012.5,1.3,2,277.1,24,9,,2020-03-29T06:14:25,2020-03-29T18:37:42,0.17,Clear,Clear conditions throughout the day.,clear-day,"42182099999,42176099999,VIDP,42139099999,42181099999"
new delhi,30-03-2020,85.3,63.7,74.2,83.4,63.7,73.8,55.3,55.3,0,0,0,,0,0,20.8,11.4,286.8,1012.4,19.2,1.9,284.6,24.7,9,,2020-03-30T06:13:15,2020-03-30T18:38:15,0.2,Clear,Clear conditions throughout the day.,clear-day,"42182099999,42176099999,VIDP,42139099999,42181099999"
new delhi,31-03-2020,89.7,63.9,75.3,87.2,63.9,74.5,54.8,53.2,0.109,100,4.17,rain,0,0,16.6,9.2,308.5,1011,38.7,2.1,254.7,22,9,,2020-03-31T06:12:06,2020-03-31T18:38:48,0.23,"Rain, Partially cloudy",Partly cloudy throughout the day with late afternoon rain.,rain,"42182099999,42176099999,VIDP,42139099999,42181099999,remote"
new delhi,01-04-2020,90.4,66,76,88.7,66,75.6,58.8,59.4,0.009,100,4.17,rain,0,0,13.9,10.3,291.7,1010.2,26.8,1.9,264.8,22.9,9,,2020-04-01T06:10:58,2020-04-01T18:39:22,0.25,"Rain, Partially cloudy",Partly cloudy throughout the day with early morning rain.,rain,"42182099999,42176099999,VIDP,42139099999,42181099999"
new delhi,02-04-2020,87.3,64.4,76.1,85.7,64.4,75.7,56,53,0,0,0,,0,0,23.5,13.9,294.2,1011.1,19.9,2.1,291.6,25.2,9,,2020-04-02T06:09:49,2020-04-02T18:39:55,0.3,Clear,Clear conditions throughout the day.,clear-day,"42182099999,42176099999,VIDP,42139099999,42181099999"
new delhi,03-04-2020,86,60.8,74.4,83.2,60.8,73.8,49.4,44.7,0,0,0,,0,0,19.9,10.3,283.4,1012,36.9,2.1,301.5,26.1,10,,2020-04-03T06:08:41,2020-04-03T18:40:28,0.34,Partially cloudy,Partly cloudy throughout the day.,partly-cloudy-day,"42182099999,42176099999,VIDP,42139099999,42181099999"
new delhi,04-04-2020,89.8,60.8,76,86.9,60.8,75.1,51.3,46.3,0,0,0,,0,0,20.8,10.3,287.3,1011.8,19.4,2,298.2,25.8,10,,2020-04-04T06:07:33,2020-04-04T18:41:02,0.37,Clear,Clear conditions throughout the day.,clear-day,"42182099999,42176099999,VIDP,42139099999,42181099999"
new delhi,05-04-2020,91.4,64.4,78.6,91.2,64.4,78.1,56.4,49.2,0,0,0,,0,0,14.1,6.9,320.3,1012.5,24.6,1.9,287.7,24.9,9,,2020-04-05T06:06:25,2020-04-05T18:41:35,0.4,Partially cloudy,Partly cloudy throughout the day.,partly-cloudy-day,"42182099999,42176099999,VIDP,42139099999,42181099999"
new delhi,06-04-2020,96.2,68,82.7,93.3,68,81.6,56.5,45,0,0,0,,0,0,19.7,11.4,299.8,1011.3,15,1.9,289,24.9,10,,2020-04-06T06:05:17,2020-04-06T18:42:08,0.44,Clear,Clear conditions throughout the day.,clear-day,"42182099999,42176099999,VIDP,42139099999,42181099999"
new delhi,07-04-2020,91.5,66.2,79.9,90.2,66.2,79.2,56.3,46.9,0,0,0,,0,0,24.2,12.8,307.1,1009.4,41.1,2,289.7,24.9,10,,2020-04-07T06:04:10,2020-04-07T18:42:42,0.47,Partially cloudy,Partly cloudy throughout the day.,partly-cloudy-day,"42182099999,42176099999,VIDP,42139099999,42181099999"
new delhi,08-04-2020,91.4,69.8,79.6,88.9,69.8,78.8,52.8,41.3,0,0,0,,0,0,19.9,11.4,299.3,1010,28.1,2.2,292.7,25.2,10,,2020-04-08T06:03:04,2020-04-08T18:43:15,0.5,Partially cloudy,Partly cloudy throughout the day.,partly-cloudy-day,"42182099999,42176099999,VIDP,42139099999,42181099999,remote"
new delhi,09-04-2020,90.8,58.1,78,89.9,58.1,77.2,51.5,42.8,0,0,0,,0,0,16.8,11.4,279,1010.5,35.3,2.4,302.9,26,10,,2020-04-09T06:01:57,2020-04-09T18:43:49,0.54,Partially cloudy,Partly cloudy throughout the day.,partly-cloudy-day,"42182099999,42176099999,VIDP,42139099999,42181099999"
new delhi,10-04-2020,95.2,65.6,82.1,93.5,65.6,80.8,52.5,39.9,0,0,0,,0,0,16.3,7.7,302.6,1011.4,31.6,2,279.3,24,9,,2020-04-10T06:00:52,2020-04-10T18:44:23,0.57,Partially cloudy,Partly cloudy throughout the day.,partly-cloudy-day,"42182099999,42176099999,VIDP,42139099999,42181099999"
new delhi,11-04-2020,98.1,70.6,84.8,98.2,70.6,83.5,53.9,37.8,0,0,0,,0,0,14.3,11.4,314.2,1012.1,31.2,2.2,297,25.5,10,,2020-04-11T05:59:46,2020-04-11T18:44:57,0.61,Partially cloudy,Partly cloudy throughout the day.,partly-cloudy-day,"42182099999,42176099999,VIDP,42139099999,42181099999"
new delhi,12-04-2020,98.6,69.8,84.6,98,69.8,83.7,55.5,39.3,0,0,0,,0,0,17.7,11.4,283.8,1010.2,31.2,2.3,299.7,25.7,10,,2020-04-12T05:58:41,2020-04-12T18:45:30,0.64,Partially cloudy,Partly cloudy throughout the day.,partly-cloudy-day,"42182099999,42176099999,VIDP,42139099999,42181099999"
new delhi,13-04-2020,99.8,72.2,86.4,101.5,72.2,86.1,57.5,40.3,0,0,0,,0,0,24.8,12.8,273.7,1008,30.6,2.2,289.6,24.9,9,,2020-04-13T05:57:37,2020-04-13T18:46:04,0.67,Partially cloudy,Partly cloudy throughout the day.,partly-cloudy-day,"42182099999,42176099999,VIDP,42139099999,42181099999"
new delhi,14-04-2020,102.3,76.8,88.9,107.8,76.8,89.1,60.7,42.8,0,0,0,,0,0,11.2,4.9,121.9,1008.2,57.4,2.2,269.7,23.1,9,,2020-04-14T05:56:33,2020-04-14T18:46:39,0.71,Partially cloudy,Partly cloudy throughout the day.,partly-cloudy-day,"42182099999,42176099999,VIDP,42139099999,42181099999"
new delhi,15-04-2020,103.2,77.9,90.2,100.5,77.9,88.1,51.2,30.9,0,0,0,,0,0,13.4,9.2,277.5,1007.8,53.1,2,262.5,22.8,9,,2020-04-15T05:55:30,2020-04-15T18:47:13,0.75,Partially cloudy,Partly cloudy throughout the day.,partly-cloudy-day,"42182099999,42176099999,VIDP,42139099999,42181099999"
new delhi,16-04-2020,101.9,74.2,87.4,100.5,74.2,86.3,54,34,0,0,0,,0,0,19.2,10.3,284.4,1006.6,34.5,2.1,291,25.3,9,,2020-04-16T05:54:27,2020-04-16T18:47:47,0.77,Partially cloudy,Partly cloudy throughout the day.,partly-cloudy-day,"42182099999,42176099999,VIDP,42139099999,42181099999"
new delhi,17-04-2020,98.6,76.7,87.9,99.2,76.7,87.1,57,36.5,0.073,100,4.17,rain,0,0,22.4,11.4,14.7,1006.1,60.3,2.4,249,21.4,10,,2020-04-17T05:53:25,2020-04-17T18:48:22,0.81,"Rain, Partially cloudy",Partly cloudy throughout the day with late afternoon rain.,rain,"42182099999,42176099999,VIDP,42139099999,42181099999"
new delhi,18-04-2020,96.8,72,84.7,99.1,72,84.4,58.2,43.2,0.073,100,4.17,rain,0,0,21.3,13.9,67,1007.9,59.9,2.2,279.8,24.3,10,,2020-04-18T05:52:24,2020-04-18T18:48:56,0.84,"Rain, Partially cloudy",Partly cloudy throughout the day with late afternoon rain.,rain,"42182099999,42176099999,VIDP,42139099999,42181099999"
new delhi,19-04-2020,95,69.7,81.7,93.8,69.7,81.1,59.7,52,0.184,100,4.17,rain,0,0,20.1,9.2,296,1007.8,47.7,2.2,293.5,25.4,9,,2020-04-19T05:51:23,2020-04-19T18:49:31,0.87,"Rain, Partially cloudy",Partly cloudy throughout the day with early morning rain.,rain,"42182099999,42176099999,VIDP,42139099999,42181099999"
new delhi,20-04-2020,89.8,71,80.7,88.9,71,80.1,57.3,47.2,0,0,0,,0,0,20.1,10.3,207.6,1008.6,56.5,2.1,246.9,21.5,9,,2020-04-20T05:50:23,2020-04-20T18:50:06,0.91,Partially cloudy,Partly cloudy throughout the day.,partly-cloudy-day,"42182099999,42176099999,VIDP,42139099999,42181099999"
new delhi,21-04-2020,93.5,68.5,81.6,93.9,68.5,80.7,56.7,46.8,0,0,0,,0,0,16.8,10.3,297.6,1008.8,45,2.2,295.5,25.6,9,,2020-04-21T05:49:24,2020-04-21T18:50:41,0.94,Partially cloudy,Partly cloudy throughout the day.,partly-cloudy-day,"42182099999,42176099999,VIDP,42139099999,42181099999,remote"
new delhi,22-04-2020,96.8,68.9,84.2,96.6,68.9,83.3,55.6,40.5,0,0,0,,0,0,15.7,9.2,282.6,1007.5,29.3,2.2,308.9,26.7,10,,2020-04-22T05:48:26,2020-04-22T18:51:16,0.97,Partially cloudy,Partly cloudy throughout the day.,partly-cloudy-day,"42182099999,42176099999,VIDP,42139099999,42181099999"
new delhi,23-04-2020,93.6,74.6,84.4,95.8,74.6,83.7,56.6,40.8,0,0,0,,0,0,24.2,11.4,303.3,1006.6,60.5,2.1,249.1,21.5,9,,2020-04-23T05:47:28,2020-04-23T18:51:51,0,Partially cloudy,Partly cloudy throughout the day.,partly-cloudy-day,"42182099999,42176099999,VIDP,42139099999,42181099999"
new delhi,24-04-2020,98,71.3,85.3,101.5,71.3,85.3,59.5,45.1,0,0,0,,0,0,11.2,6.9,143.8,1005,35.3,2.4,280.4,24.2,9,,2020-04-24T05:46:31,2020-04-24T18:52:26,0.04,Partially cloudy,Partly cloudy throughout the day.,partly-cloudy-day,"42182099999,42176099999,VIDP,42139099999,42181099999,remote"
new delhi,25-04-2020,98.9,77,87,107,77,87.1,58.5,40.2,0,0,0,,0,0,21,8.1,176.6,1005.2,55.2,2.6,261.4,22.6,9,,2020-04-25T05:45:35,2020-04-25T18:53:02,0.08,Partially cloudy,Partly cloudy throughout the day.,partly-cloudy-day,"42182099999,42176099999,VIDP,42139099999,42181099999"
new delhi,26-04-2020,87.8,69.8,77.4,90.4,69.8,77.7,63,62.3,0.079,100,12.5,rain,0,0,28.9,17.2,92.7,1008,53.3,1.8,261.3,22.5,9,,2020-04-26T05:44:40,2020-04-26T18:53:37,0.11,"Rain, Partially cloudy",Partly cloudy throughout the day with rain in the morning and afternoon.,rain,"42182099999,42176099999,VIDP,42139099999,42181099999"
new delhi,27-04-2020,93.2,66.7,79.3,96.9,66.7,79.9,63.8,63,0.703,100,4.17,rain,0,0,29.8,13.9,99.2,1010.9,26.3,2.3,242.1,20.9,9,,2020-04-27T05:43:45,2020-04-27T18:54:13,0.15,"Rain, Partially cloudy",Partly cloudy throughout the day with morning rain.,rain,"42182099999,42176099999,VIDP,42139099999,42181099999"
new delhi,28-04-2020,91.9,74.6,83.5,100.2,74.6,85.6,66.6,58.8,0,0,0,,0,0,16.1,8.1,95.2,1010.8,37.3,2.3,270.8,23.6,9,,2020-04-28T05:42:52,2020-04-28T18:54:49,0.18,Partially cloudy,Partly cloudy throughout the day.,partly-cloudy-day,"42182099999,42176099999,VIDP,42139099999,42181099999"
new delhi,29-04-2020,96.8,75.2,86.7,104,75.2,89.1,66.8,54.1,0,0,0,,0,0,12.3,9.4,156.6,1008.1,27.2,2,291.3,25.2,9,,2020-04-29T05:41:59,2020-04-29T18:55:25,0.22,Partially cloudy,Partly cloudy throughout the day.,partly-cloudy-day,"42182099999,42176099999,VIDP,42139099999,42181099999"
new delhi,30-04-2020,100.5,79.5,88.7,108.9,79.5,92.1,67.4,52,0,0,0,,0,0,20.8,9.2,105.1,1007.4,40.5,2.1,286.9,24.8,10,,2020-04-30T05:41:07,2020-04-30T18:56:01,0.25,Partially cloudy,Partly cloudy throughout the day.,partly-cloudy-day,"42182099999,42176099999,VIDP,42139099999,42181099999"
new delhi,01-05-2020,102.2,77,88.8,113.4,77,93.1,68.4,53.8,0,0,0,,0,0,14.5,10.3,76.6,1005.8,13.2,2.1,305.1,26.3,10,,2020-05-01T05:40:17,2020-05-01T18:56:37,0.25,Clear,Clear conditions throughout the day.,clear-day,"42182099999,42176099999,VIDP,42139099999,42181099999"
new delhi,02-05-2020,98.7,77,87,111.8,77,92.6,70.7,59.5,0,0,0,,0,0,26.2,13,100.6,1005.4,25.4,1.8,301.3,26.1,10,,2020-05-02T05:39:27,2020-05-02T18:57:13,0.32,Partially cloudy,Partly cloudy throughout the day.,partly-cloudy-day,"42182099999,42176099999,VIDP,42139099999,42181099999,remote"
new delhi,03-05-2020,93.6,73.4,82.6,110.2,73.4,86.8,70.4,67.9,0.48,100,12.5,rain,0,0,26.6,15.2,94.4,1006.6,67.3,1.7,233.5,20.1,7,,2020-05-03T05:38:38,2020-05-03T18:57:49,0.35,"Rain, Partially cloudy",Partly cloudy throughout the day with rain.,rain,"42182099999,42176099999,VIDP,42139099999,42181099999,remote"
new delhi,04-05-2020,94.8,70.1,82.4,103.6,70.1,84.3,66.9,62.6,0,0,0,,0,0,15.2,9.2,32.8,1008.2,45.2,2.2,288.9,24.9,9,,2020-05-04T05:37:51,2020-05-04T18:58:25,0.39,Partially cloudy,Partly cloudy throughout the day.,partly-cloudy-day,"42182099999,42176099999,VIDP,42139099999,42181099999"
new delhi,05-05-2020,97.8,75.1,87.3,105.1,75.1,89.5,66.1,52.5,0,0,0,,0,0,16.1,9.2,298.1,1006.9,42,2.2,298.7,25.6,9,,2020-05-05T05:37:04,2020-05-05T18:59:02,0.42,Partially cloudy,Partly cloudy throughout the day.,partly-cloudy-day,"42182099999,42176099999,VIDP,42139099999,42181099999"
new delhi,06-05-2020,93.1,77.2,85.5,93.3,77.2,85.4,60.2,44.6,0,0,0,,0,0,20.8,9.2,96.6,1006.4,52.1,2,299.9,25.9,10,,2020-05-06T05:36:18,2020-05-06T18:59:38,0.46,Partially cloudy,Partly cloudy throughout the day.,partly-cloudy-day,"42182099999,42176099999,VIDP,42139099999,42181099999"
new delhi,07-05-2020,98.6,73.8,86.3,96.3,73.8,85.3,56.8,39.9,0,0,0,,0,0,21.5,10.3,87.3,1007,12,2.6,317.4,27.3,10,,2020-05-07T05:35:34,2020-05-07T19:00:15,0.5,Clear,Clear conditions throughout the day.,clear-day,"42182099999,42176099999,VIDP,42139099999,42181099999"
new delhi,08-05-2020,102.5,75.5,89.9,103.6,75.5,90.1,60.9,41.8,0,0,0,,0,0,11.9,8.1,118.7,1005.2,6,2.3,314.2,27.1,10,,2020-05-08T05:34:51,2020-05-08T19:00:51,0.53,Clear,Clear conditions throughout the day.,clear-day,"42182099999,42176099999,VIDP,42139099999,42181099999"
new delhi,09-05-2020,105.8,77,91.8,108.9,77,95.4,66.6,47,0,0,0,,0,0,16.3,10.3,112.2,1005.6,11.5,2.1,307.3,26.6,10,,2020-05-09T05:34:08,2020-05-09T19:01:27,0.56,Clear,Clear conditions throughout the day.,clear-day,"42182099999,42176099999,VIDP,42139099999,42181099999"
new delhi,10-05-2020,95.1,75.5,83.3,103.4,75.5,85.7,65.5,55.6,0.037,100,8.33,rain,0,0,28.9,13.9,91.5,1007,51.2,1.9,287.9,25,9,,2020-05-10T05:33:27,2020-05-10T19:02:04,0.59,"Rain, Partially cloudy",Partly cloudy throughout the day with rain.,rain,"42182099999,42176099999,VIDP,42139099999,42181099999"
new delhi,11-05-2020,95,71.6,84.1,100.6,71.6,85.8,64.2,53.1,0,0,0,,0,0,21.7,10.3,103.5,1007.9,44.4,2,284.6,24.6,9,,2020-05-11T05:32:47,2020-05-11T19:02:40,0.63,Partially cloudy,Becoming cloudy in the afternoon.,partly-cloudy-day,"42182099999,42176099999,VIDP,42139099999,42181099999"
new delhi,12-05-2020,98.7,78.2,88.1,102.6,78.2,90.1,65,48.5,0,0,0,,0,0,17,9.2,74.1,1007.5,43.4,2.2,294.3,25.5,9,,2020-05-12T05:32:09,2020-05-12T19:03:17,0.66,Partially cloudy,Partly cloudy throughout the day.,partly-cloudy-day,"42182099999,42176099999,VIDP,42139099999,42181099999"
new delhi,13-05-2020,94.3,81.4,87,99.4,84.2,89.8,66.7,52.4,0,0,0,,0,0,17.4,6.9,14.8,1006.5,59.3,1.8,270.1,23.4,8,,2020-05-13T05:31:31,2020-05-13T19:03:53,0.69,Partially cloudy,Partly cloudy throughout the day.,partly-cloudy-day,"42182099999,42178099999,42176099999,VIDP,42139099999,42181099999"
new delhi,14-05-2020,102.2,76.8,87,108.2,76.8,89,66.2,53.2,0.015,100,4.17,rain,0,0,23,11.4,130.3,1005.6,36.2,2.1,305.3,26.5,10,,2020-05-14T05:30:55,2020-05-14T19:04:29,0.75,"Rain, Partially cloudy",Partly cloudy throughout the day with late afternoon rain.,rain,"42182099999,42176099999,VIDP,42139099999,42181099999"
new delhi,15-05-2020,102.2,77.2,89.8,103.5,77.2,90,60.9,40.6,0,0,0,,0,0,20.8,12.8,292.5,1005.2,25.9,2.2,315.6,27.2,10,,2020-05-15T05:30:20,2020-05-15T19:05:05,0.76,Partially cloudy,Partly cloudy throughout the day.,partly-cloudy-day,"42182099999,42176099999,VIDP,42139099999,42181099999"
new delhi,16-05-2020,104,76.9,90.4,101.1,76.9,89.7,57.2,36.3,0,0,0,,0,0,19.7,10.6,293.6,1004.1,10.8,2.4,326.1,28,10,,2020-05-16T05:29:46,2020-05-16T19:05:41,0.79,Clear,Clear conditions throughout the day.,clear-day,"42182099999,42176099999,VIDP,42139099999,42181099999"
new delhi,17-05-2020,104.7,75.2,90.3,104.3,75.2,89.2,56,34.2,0,0,0,,0,0,25.3,11.4,245.7,1002.6,35.3,1.8,304.6,26.3,9,,2020-05-17T05:29:13,2020-05-17T19:06:17,0.82,Partially cloudy,Partly cloudy throughout the day.,partly-cloudy-day,"42182099999,42176099999,VIDP,42139099999,42181099999"
new delhi,18-05-2020,105.8,76.1,91,104.2,76.1,89.6,53.4,32.7,0,0,0,,0,0,23,11.4,285.9,1001.7,22.7,2,328.5,28.4,10,,2020-05-18T05:28:42,2020-05-18T19:06:52,0.85,Partially cloudy,Partly cloudy throughout the day.,partly-cloudy-day,"42182099999,42176099999,VIDP,42139099999,42181099999"
new delhi,19-05-2020,105.8,74.5,92.3,102.4,74.5,90.4,51,26.8,0,0,0,,0,0,17.9,9.2,333.9,1001,25.1,2.1,319.1,27.6,10,,2020-05-19T05:28:12,2020-05-19T19:07:28,0.89,Partially cloudy,Becoming cloudy in the afternoon.,partly-cloudy-day,"42182099999,42176099999,VIDP,42139099999,42181099999"
new delhi,20-05-2020,104,75,91.5,100,75,88.6,47,23.7,0,0,0,,0,0,22.4,12.8,297.2,1000.8,17.6,2.1,333.4,29,10,,2020-05-20T05:27:43,2020-05-20T19:08:03,0.92,Clear,Clear conditions throughout the day.,clear-day,"42182099999,42176099999,VIDP,42139099999,42181099999"
new delhi,21-05-2020,107.6,78.8,94.6,103.5,78.8,91.5,47.3,22.4,0,0,0,,0,0,24.4,15,289.5,1000,0,2.5,334.8,29.1,10,,2020-05-21T05:27:16,2020-05-21T19:08:38,0.95,Clear,Clear conditions throughout the day.,clear-day,"42182099999,42176099999,VIDP,42139099999,42181099999"
new delhi,22-05-2020,111.2,77.3,96,111.2,77.3,94,50.1,24.1,0,0,0,,0,0,18.3,12.8,288,999.9,0,2.3,327.9,28.4,10,,2020-05-22T05:26:50,2020-05-22T19:09:13,0,Clear,Clear conditions throughout the day.,clear-day,"42182099999,42176099999,VIDP,42139099999,42181099999"
new delhi,23-05-2020,111.2,81.6,98.6,111.2,83.4,97,52.9,24.3,0,0,0,,0,0,20.8,13.9,275.4,1001,35,2.2,304.2,26.2,9,,2020-05-23T05:26:25,2020-05-23T19:09:47,0.02,Partially cloudy,Partly cloudy throughout the day.,partly-cloudy-day,"42182099999,42176099999,VIDP,42139099999,42181099999"
new delhi,24-05-2020,113,86.7,100.7,113,86.5,98.6,50.5,20.5,0,0,0,,0,0,23,13.9,283.5,1001.6,32.9,2.2,324.7,28.2,10,,2020-05-24T05:26:01,2020-05-24T19:10:21,0.05,Partially cloudy,Clearing in the afternoon.,partly-cloudy-day,"42182099999,42176099999,VIDP,42139099999,42181099999"
new delhi,25-05-2020,111.2,84,98.6,111.2,82.7,97.6,54.4,25.3,0,0,0,,0,0,20.8,13.4,273.7,1001.3,12.6,2.5,327.7,28.5,10,,2020-05-25T05:25:39,2020-05-25T19:10:55,0.09,Clear,Clear conditions throughout the day.,clear-day,"42182099999,42176099999,VIDP,42139099999,42181099999"
new delhi,26-05-2020,113.8,85.5,100.4,113.8,85.8,99.5,54,24,0,0,0,,0,0,25.3,12.1,278.6,999.4,26.3,2.4,318.3,27.7,10,,2020-05-26T05:25:18,2020-05-26T19:11:28,0.13,Partially cloudy,Partly cloudy throughout the day.,partly-cloudy-day,"42182099999,42176099999,VIDP,42139099999,42181099999,remote"
new delhi,27-05-2020,113.3,87.1,100.2,113.3,85.4,99.5,53.7,23.4,0,0,0,,0,0,20.8,13.9,325.8,997.9,44.3,2.5,312.9,27,10,,2020-05-27T05:24:59,2020-05-27T19:12:01,0.16,Partially cloudy,Partly cloudy throughout the day.,partly-cloudy-day,"42182099999,42176099999,VIDP,42139099999,42181099999"
new delhi,28-05-2020,103.4,75.2,92.4,110.7,75.2,95.1,65.1,43.2,0.115,100,4.17,rain,0,0,32.2,15,94.8,999.7,62.8,2.1,294.3,25.5,9,,2020-05-28T05:24:41,2020-05-28T19:12:33,0.2,"Rain, Partially cloudy",Partly cloudy throughout the day with late afternoon rain.,rain,"42182099999,42176099999,VIDP,42139099999,42181099999,remote"
new delhi,29-05-2020,95,76,84.3,98.6,76,86.9,68.7,61.7,0.155,100,4.17,rain,0,0,30,14.1,94,1002.9,72.8,1.7,276.6,23.9,9,,2020-05-29T05:24:24,2020-05-29T19:13:05,0.23,"Rain, Partially cloudy",Partly cloudy throughout the day with late afternoon rain.,rain,"42182099999,42176099999,VIDP,42139099999,42181099999,remote"
new delhi,30-05-2020,93.3,75.2,83.5,99.5,75.2,86.4,68.9,62.8,0,0,0,,0,0,27.5,13.9,129.9,1005.1,47.5,2.2,239.4,20.7,8,,2020-05-30T05:24:09,2020-05-30T19:13:37,0.25,Partially cloudy,Partly cloudy throughout the day.,partly-cloudy-day,"42182099999,42176099999,VIDP,42139099999,42181099999,remote"
new delhi,31-05-2020,92.2,70.6,78.5,101.4,70.6,80.2,70.8,79,0.444,100,12.5,rain,0,0,32.2,20.8,138.3,1007.1,67.2,2,260,22.6,9,,2020-05-31T05:23:55,2020-05-31T19:14:08,0.3,"Rain, Partially cloudy",Partly cloudy throughout the day with rain.,rain,"42182099999,42176099999,VIDP,42139099999,42181099999,remote"
new delhi,01-06-2020,95,71.6,83.7,102.6,71.6,86.7,68.6,63.1,0,0,0,,0,0,15.2,5.8,67.7,1007.2,33.3,2.3,310.2,26.8,10,,2020-06-01T05:23:42,2020-06-01T19:14:38,0.34,Partially cloudy,Partly cloudy throughout the day.,partly-cloudy-day,"42182099999,42176099999,VIDP,42139099999,42181099999"
new delhi,02-06-2020,97.3,78.8,87.7,100.2,78.8,90.9,67.5,54,0,0,0,,0,0,13.6,13.9,277,1005.4,41.6,2.3,291.9,25.2,9,,2020-06-02T05:23:31,2020-06-02T19:15:08,0.37,Partially cloudy,Partly cloudy throughout the day.,partly-cloudy-day,"42182099999,42176099999,VIDP,42139099999,42181099999"
new delhi,03-06-2020,96.9,78.8,88,102.7,78.8,91.7,68.2,54.6,0.018,100,4.17,rain,0,0,15.9,6.9,249.8,1003.5,38.5,2.2,285.3,24.7,9,,2020-06-03T05:23:21,2020-06-03T19:15:37,0.41,"Rain, Partially cloudy",Partly cloudy throughout the day with late afternoon rain.,rain,"42182099999,42176099999,VIDP,42139099999,42181099999,remote"
new delhi,04-06-2020,94.4,78.8,84.7,103.5,78.8,88,69,60.6,0.002,100,4.17,rain,0,0,25.3,13.9,119,1002.5,65.7,1.8,208.2,18,7,,2020-06-04T05:23:12,2020-06-04T19:16:06,0.45,"Rain, Partially cloudy",Partly cloudy throughout the day with late afternoon rain.,rain,"42182099999,42176099999,VIDP,42139099999,42181099999"
new delhi,05-06-2020,95,78.8,84.3,101,78.8,86.6,67.9,59.4,0.042,100,12.5,rain,0,0,17,13.9,130.8,1002.8,63.2,1.8,276.9,24.1,9,,2020-06-05T05:23:05,2020-06-05T19:16:33,0.48,"Rain, Partially cloudy",Partly cloudy throughout the day with a chance of rain throughout the day.,rain,"42182099999,42176099999,VIDP,42139099999,42181099999"
new delhi,06-06-2020,97.1,77,86.5,106.8,77,91.5,71.4,62.7,0,0,0,,0,0,13.6,9.2,117.2,1002,45.4,2.2,291.2,25.1,9,,2020-06-06T05:22:59,2020-06-06T19:17:01,0.5,Partially cloudy,Partly cloudy throughout the day.,partly-cloudy-day,"42182099999,42176099999,VIDP,42139099999,42181099999"
new delhi,07-06-2020,93.4,75.2,84.9,104.3,75.2,89.6,71.1,64.9,0.273,100,16.67,rain,0,0,23,11.4,45.6,1001.9,44.9,1.7,291,25.3,9,,2020-06-07T05:22:55,2020-06-07T19:17:27,0.55,"Rain, Partially cloudy",Partly cloudy throughout the day with a chance of rain throughout the day.,rain,"42182099999,42176099999,VIDP,42139099999,42181099999"
new delhi,08-06-2020,99,78.3,89.4,109.1,78.3,94.8,70.5,56,0,0,0,,0,0,19.2,10.8,306.7,1001.4,20,1.9,290.1,25.5,9,,2020-06-08T05:22:51,2020-06-08T19:17:53,0.58,Clear,Partly cloudy throughout the day.,clear-day,"42182099999,42176099999,VIDP,42139099999,42181099999"
new delhi,09-06-2020,104,82.1,94.4,114.2,89.7,102.2,71.3,49.6,0,0,0,,0,0,19,12.8,312.9,1001.1,31.7,2.1,276,23.9,9,,2020-06-09T05:22:49,2020-06-09T19:18:17,0.61,Partially cloudy,Partly cloudy throughout the day.,partly-cloudy-day,"42182099999,42176099999,VIDP,42139099999,42181099999"
new delhi,10-06-2020,107.6,85.6,94.4,122.1,95.1,103.7,72.5,52.4,0.017,100,4.17,rain,0,0,23,15,259.5,1000.6,38.1,2.4,289.4,24.9,9,,2020-06-10T05:22:49,2020-06-10T19:18:41,0.64,"Rain, Partially cloudy",Becoming cloudy in the afternoon with late afternoon rain.,rain,"42182099999,42176099999,VIDP,42139099999,42181099999"
new delhi,11-06-2020,104.1,83.8,94.2,123.6,89.6,104.5,73.5,53.3,0,0,0,,0,0,16.1,10.3,299.6,999.4,35,2.1,284.6,24.5,9,,2020-06-11T05:22:49,2020-06-11T19:19:04,0.68,Partially cloudy,Partly cloudy throughout the day.,partly-cloudy-day,"42182099999,42176099999,VIDP,42139099999,42181099999"
new delhi,12-06-2020,104.1,87.8,96.2,123,95.8,108.5,74.4,51.7,0,0,0,,0,0,28.9,17.2,91.5,998.1,31,1.8,284.2,24.5,9,,2020-06-12T05:22:51,2020-06-12T19:19:27,0.71,Partially cloudy,Partly cloudy throughout the day.,partly-cloudy-day,"42182099999,42176099999,VIDP,42139099999,42181099999"
new delhi,13-06-2020,101.6,86,91.2,125.5,90.3,101.6,74.2,58.3,0.001,100,4.17,rain,0,0,23,10.3,108.6,998.9,53,1.7,244.1,21.1,8,,2020-06-13T05:22:54,2020-06-13T19:19:48,0.75,"Rain, Partially cloudy",Partly cloudy throughout the day with afternoon rain.,rain,"42182099999,42176099999,VIDP,42139099999,42181099999"
new delhi,14-06-2020,103.8,83.9,93.7,118.5,90.9,105.1,74.8,56.1,0,0,0,,0,0,16.3,8.1,40.4,1000.3,45.4,1.9,247,21.5,9,,2020-06-14T05:22:59,2020-06-14T19:20:08,0.77,Partially cloudy,Partly cloudy throughout the day.,partly-cloudy-day,"42182099999,42176099999,VIDP,42139099999,42181099999"
new delhi,15-06-2020,106.1,86.3,97,121.3,94.8,105.7,71.1,45.5,0,0,0,,0,0,17.4,10.3,242.9,998.3,28.6,2.5,299.7,26,9,,2020-06-15T05:23:05,2020-06-15T19:20:27,0.81,Partially cloudy,Partly cloudy throughout the day.,partly-cloudy-day,"42182099999,42176099999,VIDP,42139099999,42181099999"
new delhi,16-06-2020,106.9,88,96.4,122.8,96.4,106.2,72.3,47.7,0,0,0,,0,0,20.8,16.3,118.7,996,42.3,2.4,271.3,23.3,9,,2020-06-16T05:23:11,2020-06-16T19:20:46,0.84,Partially cloudy,Partly cloudy throughout the day.,partly-cloudy-day,"42182099999,42176099999,VIDP,42139099999,42181099999"
new delhi,17-06-2020,104.5,87.5,95.8,131.9,97.7,109.2,75.4,53.4,0,0,0,,0,0,16.3,11.4,99.1,995.6,20.6,2.3,302.1,25.9,9,,2020-06-17T05:23:19,2020-06-17T19:21:03,0.87,Partially cloudy,Partly cloudy throughout the day.,partly-cloudy-day,"42182099999,42176099999,VIDP,42139099999,42181099999,VIDD"
new delhi,18-06-2020,107.8,85.7,97,130.1,95.2,112.7,76.7,54.6,0,0,0,,0,0,16.6,9.2,108.9,996,13.5,2.3,303.3,26.1,9,,2020-06-18T05:23:29,2020-06-18T19:21:19,0.9,Clear,Clear conditions throughout the day.,clear-day,"42182099999,42176099999,VIDP,42139099999,42181099999,VIDD"
new delhi,19-06-2020,105.8,88.1,96.8,121.2,100.2,111.9,76.7,54,0,0,0,,0,0,22.8,12.8,104.5,998,33.4,2,290.4,25.1,9,,2020-06-19T05:23:39,2020-06-19T19:21:34,0.94,Partially cloudy,Partly cloudy throughout the day.,partly-cloudy-day,"42182099999,42176099999,VIDP,42139099999,42181099999,VIDD"
new delhi,20-06-2020,100.2,77.9,89.3,121.6,77.9,100.5,75.2,63.8,0.197,100,8.33,rain,0,0,29.5,13.2,216.6,1000.2,69.7,1.9,259.2,22.5,9,,2020-06-20T05:23:50,2020-06-20T19:21:48,0.97,"Rain, Partially cloudy",Partly cloudy throughout the day with rain clearing later.,rain,"42182099999,42176099999,VIDP,42139099999,42181099999,VIDD"
new delhi,21-06-2020,96.8,80.6,88.8,118.5,86.1,101.2,76.6,68.7,0.003,100,4.17,rain,0,0,22.1,8.1,92.8,999.9,57.1,1.9,284.7,24.6,9,,2020-06-21T05:24:03,2020-06-21T19:22:01,0,"Rain, Partially cloudy",Partly cloudy throughout the day with early morning rain.,rain,"42182099999,42176099999,VIDP,42139099999,42181099999,VIDD"
new delhi,22-06-2020,98.6,77.4,89.5,114.1,77.4,100.4,76.2,66.8,1.607,100,4.17,rain,0,0,14.8,8.1,25.2,999.6,42.2,2,264.9,22.9,8,,2020-06-22T05:24:17,2020-06-22T19:22:13,0.04,"Rain, Partially cloudy",Partly cloudy throughout the day with morning rain.,rain,"42182099999,42176099999,VIDP,42139099999,42181099999,VIDD"
new delhi,23-06-2020,98.3,83.8,91,122.5,92.4,107.9,79.1,68.6,0,0,0,,0,0,25.3,9.2,87.9,1001.7,34,2.1,242.4,21,8,,2020-06-23T05:24:31,2020-06-23T19:22:23,0.07,Partially cloudy,Partly cloudy throughout the day.,partly-cloudy-day,"42182099999,42176099999,VIDP,42139099999,42181099999,VIDD"
new delhi,24-06-2020,93.2,82.6,87.7,116.4,92.4,103.6,79.6,77.5,0.474,100,4.17,rain,0,0,19.7,10.3,83.1,1002.8,60.6,2,188.9,16.4,6,,2020-06-24T05:24:47,2020-06-24T19:22:33,0.11,"Rain, Partially cloudy",Partly cloudy throughout the day with morning rain.,rain,"42182099999,42176099999,VIDP,42139099999,42181099999,VIDD"
new delhi,25-06-2020,97,82.6,88.7,117.7,93.7,104.8,79.7,76,0.073,100,4.17,rain,0,0,28.9,6.6,279.3,1000.3,57.8,2,274.5,23.9,8,,2020-06-25T05:25:04,2020-06-25T19:22:41,0.14,"Rain, Partially cloudy",Partly cloudy throughout the day with afternoon rain.,rain,"42182099999,42176099999,VIDP,42139099999,42181099999,VIDD"
new delhi,26-06-2020,98.4,83.9,90,119.5,94.1,105.7,78.9,70.8,0.015,100,4.17,rain,0,0,27.1,11.5,260.6,999.2,47.6,2,221.5,19.2,7,,2020-06-26T05:25:22,2020-06-26T19:22:48,0.18,"Rain, Partially cloudy",Partly cloudy throughout the day with morning rain.,rain,"42182099999,42176099999,VIDP,42139099999,42181099999,VIDD"
new delhi,27-06-2020,104,85.3,93.2,124.6,93.4,108.7,77.6,61.7,0,0,0,,0,0,24.7,14.8,251.8,998.1,52.5,2,251,21.7,9,,2020-06-27T05:25:40,2020-06-27T19:22:53,0.22,Partially cloudy,Partly cloudy throughout the day.,partly-cloudy-day,"42182099999,42176099999,VIDP,42139099999,42181099999,VIDD"
new delhi,28-06-2020,104.2,86.8,97,127.7,97.7,113.9,77.5,54.9,0,0,0,,0,0,30,16.3,250.4,997.2,52.3,1.8,247.8,21.5,8,,2020-06-28T05:26:00,2020-06-28T19:22:57,0.25,Partially cloudy,Partly cloudy throughout the day.,partly-cloudy-day,"42182099999,42176099999,VIDP,42139099999,42181099999,VIDD"
new delhi,29-06-2020,105.6,83.2,95.1,121.4,88.4,106.9,74.4,52.9,0.109,100,4.17,rain,0,0,42.5,12.7,259.7,999.1,59.7,2,253.7,21.9,9,,2020-06-29T05:26:21,2020-06-29T19:23:00,0.29,"Rain, Partially cloudy",Partly cloudy throughout the day with late afternoon rain.,rain,"42182099999,42176099999,VIDP,42139099999,42181099999,VIDD"
new delhi,30-06-2020,98.6,81,89.9,128.5,86.9,106.6,78.9,70.6,0,0,0,,0,0,42.5,10.3,105.6,1000.8,56.5,1.9,243.9,21.2,9,,2020-06-30T05:26:42,2020-06-30T19:23:02,0.32,Partially cloudy,Partly cloudy throughout the day.,partly-cloudy-day,"42182099999,42176099999,VIDP,42139099999,42181099999,VIDD"
new delhi,01-07-2020,100.3,86.4,93.1,125,99.9,111.6,79.6,65.8,0,0,0,,0,0,16.6,16,91.1,999.4,58.1,2,275.2,23.8,9,,2020-07-01T05:27:04,2020-07-01T19:23:03,0.36,Partially cloudy,Partly cloudy throughout the day.,partly-cloudy-day,"42182099999,42176099999,VIDP,42139099999,42181099999,VIDD"
new delhi,02-07-2020,103.8,87.8,95.8,131.8,99.9,117.4,80.6,62.4,0,0,0,,0,0,15,6.9,87.6,997,47,1.7,275,23.8,8,,2020-07-02T05:27:27,2020-07-02T19:23:02,0.39,Partially cloudy,Partly cloudy throughout the day.,partly-cloudy-day,"42182099999,42176099999,VIDP,42139099999,42181099999,VIDD"
new delhi,03-07-2020,105.8,88.8,95.4,137.2,100.5,115.9,80,62.3,0.07,100,8.33,rain,0,0,40.3,10.3,44,996.5,51.7,1.9,276,23.9,9,,2020-07-03T05:27:51,2020-07-03T19:22:59,0.43,"Rain, Partially cloudy",Partly cloudy throughout the day with afternoon rain.,rain,"42182099999,42176099999,VIDP,42139099999,42181099999,VIDD"
new delhi,04-07-2020,102.9,86,92.6,120.7,95.2,109.1,78.6,65,0,0,0,,0,0,22.1,10.3,87.1,997.1,46.3,2.2,235.5,20.4,8,,2020-07-04T05:28:16,2020-07-04T19:22:56,0.47,Partially cloudy,Partly cloudy throughout the day.,partly-cloudy-day,"42182099999,42176099999,VIDP,42139099999,42181099999,VIDD"
new delhi,05-07-2020,93.2,73.4,84.5,112.3,73.4,94.3,76.9,79.3,1.383,100,8.33,rain,0,0,23,11.4,61.5,998.2,59.1,1.9,204,17.7,8,,2020-07-05T05:28:41,2020-07-05T19:22:51,0.5,"Rain, Partially cloudy",Partly cloudy throughout the day with rain clearing later.,rain,"42182099999,42176099999,VIDP,42139099999,42181099999,VIDD,remote"
new delhi,06-07-2020,95,80.7,87.9,117.3,87.3,103,79.3,76.4,0.022,100,4.17,rain,0,0,20.8,10.3,83.4,997.5,47.7,1.6,258.2,22.3,8,,2020-07-06T05:29:07,2020-07-06T19:22:44,0.53,"Rain, Partially cloudy",Partly cloudy throughout the day with afternoon rain.,rain,"42182099999,42176099999,VIDP,42139099999,42181099999,VIDD,remote"
new delhi,07-07-2020,94.7,82.2,86.2,115,90.8,99.4,78.7,79,0.006,100,4.17,rain,0,0,26.8,11.4,85.1,1000.2,62.9,2.1,179.2,15.4,7,,2020-07-07T05:29:33,2020-07-07T19:22:36,0.57,"Rain, Partially cloudy",Partly cloudy throughout the day with afternoon rain.,rain,"42182099999,42176099999,VIDP,42139099999,42181099999,VIDD"
new delhi,08-07-2020,96.6,80.6,86.3,125.4,88.1,101.9,80.6,83.9,0.006,100,4.17,rain,0,0,21.3,11.1,31.7,1001.6,75.7,1.5,158.9,13.8,7,,2020-07-08T05:30:01,2020-07-08T19:22:27,0.6,"Rain, Partially cloudy",Partly cloudy throughout the day with late afternoon rain.,rain,"42182099999,42176099999,VIDP,42139099999,42181099999,VIDD"
new delhi,09-07-2020,99.9,82.4,90.1,119.2,94.1,106.2,79.5,72.5,0,0,0,,0,0,16.3,6.7,260.1,998.1,59.2,2.1,157.6,13.6,6,,2020-07-09T05:30:28,2020-07-09T19:22:17,0.63,Partially cloudy,Partly cloudy throughout the day.,partly-cloudy-day,"42182099999,42176099999,VIDP,42139099999,42181099999,VIDD"
new delhi,10-07-2020,100.5,83.3,92.6,122.9,94.8,110.1,79.2,66.5,0.255,100,4.17,rain,0,0,29.8,11.4,251.1,995.9,55.9,2.1,243,21.1,8,,2020-07-10T05:30:57,2020-07-10T19:22:05,0.66,"Rain, Partially cloudy",Partly cloudy throughout the day with late afternoon rain.,rain,"42182099999,42176099999,VIDP,42139099999,42181099999,VIDD"
new delhi,11-07-2020,98.1,77.3,88.3,120.5,77.3,100.9,78,73,0.006,100,4.17,rain,0,0,28.9,11.4,312.2,997.2,60,2.3,251.5,21.7,8,,2020-07-11T05:31:26,2020-07-11T19:21:51,0.7,"Rain, Partially cloudy",Partly cloudy throughout the day with early morning rain.,rain,"42182099999,42176099999,VIDP,42139099999,42181099999,VIDD"
new delhi,12-07-2020,94.8,78.8,87.3,111.8,78.8,99,76.4,71.2,0,0,0,,0,0,23,10.3,332.9,998.6,48.9,2.2,208.9,18,7,,2020-07-12T05:31:55,2020-07-12T19:21:36,0.73,Partially cloudy,Partly cloudy throughout the day.,partly-cloudy-day,"42182099999,42176099999,VIDP,42139099999,42181099999,VIDD"
new delhi,13-07-2020,98.3,80.6,89.7,111.8,86.1,100.5,75.7,65,0,0,0,,0,0,23.3,7,283.8,998.3,43.3,2.2,258.8,22.5,9,,2020-07-13T05:32:25,2020-07-13T19:21:20,0.75,Partially cloudy,Partly cloudy throughout the day.,partly-cloudy-day,"42182099999,42176099999,VIDP,42139099999,42181099999,VIDD"
new delhi,14-07-2020,100.4,84,92.3,122.1,94.1,107.8,78.2,64.9,0,0,0,,0,0,15.9,8.8,276.5,999.2,59.1,2.1,256.8,22.1,8,,2020-07-14T05:32:55,2020-07-14T19:21:03,0.79,Partially cloudy,Partly cloudy throughout the day.,partly-cloudy-day,"42182099999,42176099999,VIDP,42139099999,42181099999"
new delhi,15-07-2020,97.9,86,91.1,118.6,99.4,107.8,79.1,68.8,0,0,0,,0,0,20.8,11.4,91.2,999.8,52.5,1.9,236.2,20.3,8,,2020-07-15T05:33:26,2020-07-15T19:20:44,0.82,Partially cloudy,Partly cloudy throughout the day.,partly-cloudy-day,"42182099999,42176099999,VIDP,42139099999,42181099999"
new delhi,16-07-2020,99,84.5,89.6,121.9,97.2,105.1,78.9,71.7,0,0,0,,0,0,21.3,9.2,95.6,998.9,60.2,1.8,231.6,20.1,8,,2020-07-16T05:33:57,2020-07-16T19:20:23,0.86,Partially cloudy,Partly cloudy throughout the day.,partly-cloudy-day,"42182099999,42176099999,VIDP,42139099999,42181099999"
new delhi,17-07-2020,96.1,84.2,90,117.4,96.1,108.1,80.3,73.8,0.146,100,4.17,rain,0,0,20.1,12.8,97,999.7,61,1.6,213.6,18.3,7,,2020-07-17T05:34:28,2020-07-17T19:20:02,0.89,"Rain, Partially cloudy",Partly cloudy throughout the day with afternoon rain.,rain,"42182099999,42176099999,VIDP,42139099999,42181099999"
new delhi,18-07-2020,95,86,89.8,122,101.9,108.9,81,75.9,0,0,0,,0,0,16.3,11.4,93.4,1000.7,68.8,1.6,222.7,19.4,8,,2020-07-18T05:35:00,2020-07-18T19:19:39,0.92,Partially cloudy,Partly cloudy throughout the day.,partly-cloudy-day,"42182099999,42176099999,VIDP,42139099999,42181099999"
new delhi,19-07-2020,93,79.1,86.6,116.7,79.1,102.2,80.5,82.5,2.675,100,12.5,rain,0,0,28.9,10.3,262.4,999.5,64.1,1.8,159.7,13.7,5,,2020-07-19T05:35:32,2020-07-19T19:19:14,0.95,"Rain, Partially cloudy",Partly cloudy throughout the day with rain clearing later.,rain,"42182099999,42176099999,VIDP,42139099999,42181099999"
new delhi,20-07-2020,90.1,78.8,83.2,105.4,78.8,90.5,76.3,80.1,0.009,100,8.33,rain,0,0,24.8,13.9,259.9,998,65.7,2.1,173.2,15.1,7,,2020-07-20T05:36:04,2020-07-20T19:18:48,0,"Rain, Partially cloudy",Partly cloudy throughout the day with rain.,rain,"42182099999,42176099999,VIDP,42139099999,42181099999"
new delhi,21-07-2020,88.8,75.6,80,100.5,75.6,83.3,76.5,90,1.07,100,12.5,rain,0,0,21,13.9,93.9,1000.9,74.9,1.5,185.1,16.2,8,,2020-07-21T05:36:37,2020-07-21T19:18:21,0.02,"Rain, Partially cloudy",Partly cloudy throughout the day with rain.,rain,"42182099999,42176099999,VIDP,42139099999,42181099999"
new delhi,22-07-2020,82.4,76.4,79.2,89.4,76.4,81.9,77.1,93.3,2.933,100,12.5,rain,0,0,29.3,8.1,256.6,1002,71.7,1.6,142.8,12.5,7,,2020-07-22T05:37:10,2020-07-22T19:17:52,0.06,"Rain, Partially cloudy",Partly cloudy throughout the day with a chance of rain throughout the day.,rain,"42182099999,42176099999,VIDP,42139099999,42181099999"
new delhi,23-07-2020,93.4,76.7,84.6,108.6,76.7,92.4,76.8,79.1,0,0,0,,0,0,14.8,8.1,277.1,1001,49.4,2.1,256.5,22.3,8,,2020-07-23T05:37:43,2020-07-23T19:17:23,0.09,Partially cloudy,Partly cloudy throughout the day.,partly-cloudy-day,"42182099999,42176099999,VIDP,42139099999,42181099999"
new delhi,24-07-2020,94.8,78.8,86.1,114.9,78.8,99,79,80.4,0.104,100,12.5,rain,0,0,20.8,7.3,88.3,1003.6,56.1,1.5,236,20.6,7,,2020-07-24T05:38:16,2020-07-24T19:16:51,0.13,"Rain, Partially cloudy",Partly cloudy throughout the day with rain.,rain,"42182099999,42176099999,VIDP,42139099999,42181099999,VIDD"
new delhi,25-07-2020,95.1,78.8,86.6,120.3,78.8,102.4,80.8,83.7,0,0,0,,0,0,16.6,6.9,88.1,1005.3,60.1,1.7,227.1,19.6,8,,2020-07-25T05:38:49,2020-07-25T19:16:19,0.16,Partially cloudy,Partly cloudy throughout the day.,partly-cloudy-day,"42182099999,42176099999,VIDP,42139099999,42181099999,VIDD"
new delhi,26-07-2020,96.5,82.4,88.9,118.3,93.4,105.8,80.3,76.9,0.022,100,4.17,rain,0,0,14.1,9,82.7,1005,42.5,2,212.1,18.4,7,,2020-07-26T05:39:23,2020-07-26T19:15:45,0.2,"Rain, Partially cloudy",Partly cloudy throughout the day with afternoon rain.,rain,"42182099999,42176099999,VIDP,42139099999,42181099999,VIDD"
new delhi,27-07-2020,98.4,84.2,91.2,121.1,98.2,110.1,80.7,72.7,0,0,0,,0,0,20.1,9.4,254.8,1002,50.3,2.4,231.4,20,8,,2020-07-27T05:39:56,2020-07-27T19:15:10,0.25,Partially cloudy,Partly cloudy throughout the day.,partly-cloudy-day,"42182099999,42176099999,VIDP,42139099999,42181099999,VIDD"
new delhi,28-07-2020,98.4,84.2,91.8,125,99.4,113.4,81.9,73.9,0,0,0,,0,0,23.3,8.2,258.7,1000,39.8,2.4,241.5,20.9,8,,2020-07-28T05:40:30,2020-07-28T19:14:33,0.27,Partially cloudy,Partly cloudy throughout the day.,partly-cloudy-day,"42182099999,42176099999,VIDP,42139099999,42181099999,VIDD"
new delhi,29-07-2020,97,78.8,86.4,121.1,78.8,100.2,79.4,80.6,0.366,100,8.33,rain,0,0,20.8,5.8,129.1,1000.6,69.7,2,202.8,17.7,7,,2020-07-29T05:41:03,2020-07-29T19:13:56,0.31,"Rain, Partially cloudy",Partly cloudy throughout the day with afternoon rain.,rain,"42182099999,42176099999,VIDP,42139099999,42181099999,VIDD"
new delhi,30-07-2020,88.1,78.8,83.8,100.1,78.8,92.2,76.7,79.7,0,0,0,,0,0,16.3,8.2,189.2,1002.6,58.1,2.1,206,17.8,7,,2020-07-30T05:41:37,2020-07-30T19:13:17,0.34,Partially cloudy,Partly cloudy throughout the day.,partly-cloudy-day,"42182099999,42176099999,VIDP,42139099999,42181099999,VIDD"
new delhi,31-07-2020,93,81.6,86.7,116.9,91.2,102.3,80.2,81.6,0.047,100,8.33,rain,0,0,15,5.8,106.7,1001.8,64,1.7,231.6,19.9,8,,2020-07-31T05:42:11,2020-07-31T19:12:37,0.38,"Rain, Partially cloudy",Partly cloudy throughout the day with rain in the morning and afternoon.,rain,"42182099999,42176099999,VIDP,42139099999,42181099999,VIDD,remote"
new delhi,01-08-2020,96.7,82.1,85.8,117.4,92.5,100.2,80,83.6,0.273,100,4.17,rain,0,0,13.9,9.2,140.2,1001.1,84.6,1.2,173.5,15,7,,2020-08-01T05:42:44,2020-08-01T19:11:55,0.41,"Rain, Partially cloudy",Partly cloudy throughout the day with afternoon rain.,rain,"42182099999,42176099999,VIDP,42139099999,42181099999,VIDD,remote"
new delhi,02-08-2020,98.3,80.7,88.8,123.4,88.4,104.8,79.9,76.4,0.029,100,4.17,rain,0,0,22.1,11.4,254.7,999.1,49.1,2.1,244.6,21.1,9,,2020-08-02T05:43:18,2020-08-02T19:11:13,0.45,"Rain, Partially cloudy",Partly cloudy throughout the day with late afternoon rain.,rain,"42182099999,42176099999,VIDP,42139099999,42181099999,VIDD,remote"
new delhi,03-08-2020,98.3,84.1,90.4,123.5,96.9,108.6,80.3,73.1,0.004,100,4.17,rain,0,0,21.9,11.4,245.2,995,52.9,2.1,230.5,19.9,8,,2020-08-03T05:43:52,2020-08-03T19:10:29,0.5,"Rain, Partially cloudy",Partly cloudy throughout the day with morning rain.,rain,"42182099999,42176099999,VIDP,42139099999,42181099999,VIDD,remote"
new delhi,04-08-2020,97.8,82.8,90,117.9,95.7,107.6,80.2,74,0.044,100,20.83,rain,0,0,21.7,7.2,334.2,993.2,46.1,1.2,229,19.9,8,,2020-08-04T05:44:25,2020-08-04T19:09:44,0.52,"Rain, Partially cloudy",Partly cloudy throughout the day with rain.,rain,"42182099999,42176099999,42139099999,42181099999,VIDD,remote"
new delhi,05-08-2020,93.1,84.5,88,116.4,98.8,107.2,81.7,82.2,0.515,100,8.33,rain,0,0,25.5,12.8,88.5,994.7,54.8,1.2,167,14.5,8,,2020-08-05T05:44:59,2020-08-05T19:08:58,0.55,"Rain, Partially cloudy",Partly cloudy throughout the day with rain in the morning and afternoon.,rain,"42182099999,42176099999,VIDP,42139099999,42181099999,remote"
new delhi,06-08-2020,98.6,83,89.8,118.1,94,105.3,79.1,71.9,0.018,100,8.33,rain,0,0,46.8,18.6,89,997.2,67,2,249.9,21.7,9,,2020-08-06T05:45:32,2020-08-06T19:08:11,0.58,"Rain, Partially cloudy",Partly cloudy throughout the day with rain.,rain,"42182099999,42176099999,VIDP,42139099999,42181099999,remote"
new delhi,07-08-2020,96.5,82.4,89,121.1,89.4,105.1,79.3,73.7,0.007,100,4.17,rain,0,0,30,16.8,93.7,1000.3,63.9,2,228.8,19.8,7,,2020-08-07T05:46:06,2020-08-07T19:07:23,0.62,"Rain, Partially cloudy",Partly cloudy throughout the day with late afternoon rain.,rain,"42182099999,42176099999,VIDP,42139099999,42181099999,VIDD,remote"
new delhi,08-08-2020,98.7,84.2,90.8,120.6,96.1,109.7,80.7,73.6,0.004,100,4.17,rain,0,0,10.5,5.8,9.3,998.4,50.4,1.9,246.2,21.2,8,,2020-08-08T05:46:39,2020-08-08T19:06:34,0.65,"Rain, Partially cloudy",Partly cloudy throughout the day with late afternoon rain.,rain,"42182099999,42176099999,VIDP,42139099999,42181099999,VIDD"
new delhi,09-08-2020,94.8,80.6,86.2,120.5,89.3,102.7,81.1,85.2,0.062,100,16.67,rain,0,0,10.7,11.4,268.7,998.1,66.9,1.7,126.6,10.8,6,,2020-08-09T05:47:12,2020-08-09T19:05:44,0.68,"Rain, Partially cloudy",Partly cloudy throughout the day with rain.,rain,"42182099999,42176099999,VIDP,42139099999,42181099999,VIDD"
new delhi,10-08-2020,93.2,82.4,87.6,117.9,94.1,105.7,81.2,81.8,0.018,100,4.17,rain,0,0,14.5,6.9,103,999.2,66.2,1.8,107.1,9.2,4,,2020-08-10T05:47:45,2020-08-10T19:04:52,0.71,"Rain, Partially cloudy",Partly cloudy throughout the day with afternoon rain.,rain,"42182099999,42176099999,VIDP,42139099999,42181099999,VIDD"
new delhi,11-08-2020,97.9,82.4,87.6,118.9,94.1,105.5,81.3,82.4,0.328,100,4.17,rain,0,0,20.8,9.2,225.2,998.9,69.1,1.7,193.3,16.6,7,,2020-08-11T05:48:18,2020-08-11T19:04:00,0.75,"Rain, Partially cloudy",Partly cloudy throughout the day with afternoon rain.,rain,"42182099999,42176099999,VIDP,42139099999,42181099999,VIDD"
new delhi,12-08-2020,96.6,77,88,117.1,77,103.2,79.7,77.7,0.449,100,8.33,rain,0,0,25.3,13.9,250.9,997.7,72.1,1.9,157.3,13.6,7,,2020-08-12T05:48:51,2020-08-12T19:03:07,0.78,"Rain, Partially cloudy",Partly cloudy throughout the day with rain.,rain,"42182099999,42176099999,VIDP,42139099999,42181099999,VIDD"
new delhi,13-08-2020,84,77.2,80.6,97.9,77.2,87.3,79.4,96.4,2.899,100,20.83,rain,0,0,15,12.8,50.9,997.7,85.5,1.2,58.4,5.2,3,,2020-08-13T05:49:24,2020-08-13T19:02:12,0.81,"Rain, Partially cloudy",Partly cloudy throughout the day with a chance of rain throughout the day.,rain,"42182099999,42176099999,VIDP,42139099999,42181099999,VIDD"
new delhi,14-08-2020,89.4,78.8,84.2,107.9,78.8,97.1,80.3,88.6,0.011,100,8.33,rain,0,0,21.7,6.3,68.8,996.8,67.9,1.8,90,7.9,4,,2020-08-14T05:49:56,2020-08-14T19:01:17,0.84,"Rain, Partially cloudy",Partly cloudy throughout the day with rain in the morning and afternoon.,rain,"42182099999,42176099999,VIDP,42139099999,42181099999,VIDD"
new delhi,15-08-2020,94.7,80.6,87.2,118.9,88.1,104,80.9,82.4,0,0,0,,0,0,19.5,7.2,103.2,996.8,62.5,1.9,170,14.5,6,,2020-08-15T05:50:29,2020-08-15T19:00:21,0.88,Partially cloudy,Partly cloudy throughout the day.,partly-cloudy-day,"42182099999,42176099999,VIDP,42139099999,42181099999,VIDD"
new delhi,16-08-2020,96.6,82.4,88,118.4,92.4,104.8,80.6,79.7,0.033,100,4.17,rain,0,0,14.8,8.8,107.3,997.9,64.2,2,202.2,17.4,7,,2020-08-16T05:51:01,2020-08-16T18:59:24,0.91,"Rain, Partially cloudy",Partly cloudy throughout the day with morning rain.,rain,"42182099999,42176099999,VIDP,42139099999,42181099999,VIDD"
new delhi,17-08-2020,94.6,82.4,86.7,118.4,94.1,105,82.1,87.1,0.877,100,8.33,rain,0,0,14.3,8.1,116.4,998.2,64.5,1.5,214.7,18.5,7,,2020-08-17T05:51:33,2020-08-17T18:58:26,0.94,"Rain, Partially cloudy",Partly cloudy throughout the day with rain.,rain,"42182099999,42176099999,VIDP,42139099999,42181099999,VIDD,remote"
new delhi,18-08-2020,94.8,82.4,86,123.2,92.4,103.1,81.5,86.9,0.035,100,8.33,rain,0,0,20.8,11.4,196.5,998.9,61.9,1.8,181.4,15.5,7,,2020-08-18T05:52:05,2020-08-18T18:57:27,0.97,"Rain, Partially cloudy",Partly cloudy throughout the day with afternoon rain.,rain,"42182099999,42176099999,VIDP,42139099999,42181099999,VIDD"
new delhi,19-08-2020,82.8,76.9,80.5,94.5,76.9,87.6,79.1,95.7,1.572,100,16.67,rain,0,0,20.8,11.2,156.8,998.9,78.3,1.4,45.6,3.9,2,,2020-08-19T05:52:37,2020-08-19T18:56:28,0,"Rain, Partially cloudy",Partly cloudy throughout the day with a chance of rain throughout the day.,rain,"42182099999,42176099999,VIDP,42139099999,42181099999,VIDD"
new delhi,20-08-2020,84.4,76.8,79.6,101,76.8,84.2,78.5,96.5,1.265,100,12.5,rain,0,0,15.7,8.1,87.1,1001.4,75.6,1.2,77.3,6.9,4,,2020-08-20T05:53:08,2020-08-20T18:55:28,0.04,"Rain, Partially cloudy",Partly cloudy throughout the day with rain clearing later.,rain,"42182099999,42176099999,VIDP,42139099999,42181099999,VIDD"
new delhi,21-08-2020,94.7,77.2,84.9,112.1,77.2,94.1,77.5,79.6,0.036,100,4.17,rain,0,0,34,9.2,74.1,1002.7,66.7,2.2,211.4,18.2,8,,2020-08-21T05:53:40,2020-08-21T18:54:26,0.08,"Rain, Partially cloudy",Partly cloudy throughout the day with late afternoon rain.,rain,"42182099999,42176099999,VIDP,42139099999,42181099999,VIDD"
new delhi,22-08-2020,94.7,80,86.6,112.1,85.6,97.6,77.1,74.5,0,0,0,,0,0,25.3,12.4,71.2,1001.8,52.7,2.3,193.1,16.5,6,,2020-08-22T05:54:11,2020-08-22T18:53:25,0.11,Partially cloudy,Partly cloudy throughout the day.,partly-cloudy-day,"42182099999,42176099999,VIDP,42139099999,42181099999,VIDD"
new delhi,23-08-2020,92.6,80.6,84.8,109.7,86.1,96.2,77.9,80.3,0.075,100,4.17,rain,0,0,25.7,10.2,76.8,1000.4,55.1,2.1,167.9,14.5,6,,2020-08-23T05:54:42,2020-08-23T18:52:22,0.15,"Rain, Partially cloudy",Partly cloudy throughout the day with afternoon rain.,rain,"42182099999,42176099999,VIDP,42139099999,42181099999,VIDD"
new delhi,24-08-2020,90.7,80.6,84.3,106.2,87.1,95.2,78.1,82,0.004,100,4.17,rain,0,0,24.8,10.3,96.2,1000.8,61.2,1.8,152.5,13.2,7,,2020-08-24T05:55:13,2020-08-24T18:51:19,0.18,"Rain, Partially cloudy",Partly cloudy throughout the day with morning rain.,rain,"42182099999,42176099999,VIDP,42139099999,42181099999,VIDD"
new delhi,25-08-2020,91.1,80.5,84.6,107.1,87.1,95.6,78,81.1,0,0,0,,0,0,20.1,9.1,135.4,1003,60.1,2.2,186,15.9,7,,2020-08-25T05:55:44,2020-08-25T18:50:15,0.25,Partially cloudy,Partly cloudy throughout the day.,partly-cloudy-day,"42182099999,42176099999,VIDP,42139099999,42181099999,VIDD"
new delhi,26-08-2020,92.9,80.6,86.1,107,87.1,97.5,77.5,76.2,0,0,0,,0,0,13.9,9,244.4,1004.3,57.7,2.2,185.8,15.9,7,,2020-08-26T05:56:15,2020-08-26T18:49:10,0.25,Partially cloudy,Partly cloudy throughout the day.,partly-cloudy-day,"42182099999,42176099999,VIDP,42139099999,42181099999,VIDD"
new delhi,27-08-2020,94.8,80.6,87.4,109.8,87.1,98.8,77.1,72.7,0,0,0,,0,0,13.4,7.2,261.3,1003.5,57.3,2.5,156.4,13.6,7,,2020-08-27T05:56:46,2020-08-27T18:48:05,0.29,Partially cloudy,Partly cloudy throughout the day.,partly-cloudy-day,"42182099999,42176099999,VIDP,42139099999,42181099999,VIDD"
new delhi,28-08-2020,91.2,78.8,83.3,107.6,78.8,92.3,78.4,86.1,0.944,100,8.33,rain,0,0,23,6.1,277.7,1001.9,59.6,1.8,197.7,17,7,,2020-08-28T05:57:16,2020-08-28T18:46:59,0.32,"Rain, Partially cloudy",Partly cloudy throughout the day with afternoon rain.,rain,"42182099999,42176099999,VIDP,42139099999,42181099999,VIDD"
new delhi,29-08-2020,94.7,78.8,85.8,114.6,78.8,96.7,78.8,80.9,0,0,0,,0,0,16.1,6.9,76.4,1001.2,62.3,1.4,223.3,19.3,8,,2020-08-29T05:57:46,2020-08-29T18:45:53,0.36,Partially cloudy,Partly cloudy throughout the day.,partly-cloudy-day,"42182099999,42176099999,VIDP,42139099999,42181099999,VIDD"
new delhi,30-08-2020,87.6,80.6,83.9,99.4,86.1,93.6,77.3,81.2,0.019,100,8.33,rain,0,0,30.6,11.4,76,1000.9,72.7,1.9,192.1,16.5,7,,2020-08-30T05:58:16,2020-08-30T18:44:46,0.4,"Rain, Partially cloudy",Partly cloudy throughout the day with rain.,rain,"42182099999,42176099999,VIDP,42139099999,42181099999,VIDD"
new delhi,31-08-2020,91.2,79,84.3,104.4,79,92.3,75.9,76.7,0,0,0,,0,0,22.6,11.4,122.5,1003.2,68.7,2.2,197.9,16.9,6,,2020-08-31T05:58:47,2020-08-31T18:43:39,0.43,Partially cloudy,Partly cloudy throughout the day.,partly-cloudy-day,"42182099999,42176099999,VIDP,42139099999,42181099999,VIDD"
new delhi,01-09-2020,94.7,78.8,85.9,106.7,78.8,93.9,75.3,71.9,0,0,0,,0,0,16.8,7.9,171.5,1004.7,45.5,2.4,185.5,16.1,6,,2020-09-01T05:59:16,2020-09-01T18:42:31,0.47,Partially cloudy,Partly cloudy throughout the day.,partly-cloudy-day,"42182099999,42176099999,VIDP,42139099999,42181099999,VIDD"
new delhi,02-09-2020,93.5,78.8,86.4,110.1,78.8,97.1,77.1,74.7,0,0,0,,0,0,11.9,6.7,237.6,1006.7,66,2.2,213.8,18.5,8,,2020-09-02T05:59:46,2020-09-02T18:41:23,0.5,Partially cloudy,Partly cloudy throughout the day.,partly-cloudy-day,"42182099999,42176099999,VIDP,42139099999,42181099999,VIDD"
new delhi,03-09-2020,94.5,82.4,87.6,114.6,90.8,101.9,78.9,75.8,0.001,100,4.17,rain,0,0,27.1,9.8,89,1007.1,67.6,1.8,182.3,15.6,8,,2020-09-03T06:00:16,2020-09-03T18:40:14,0.53,"Rain, Partially cloudy",Partly cloudy throughout the day with afternoon rain.,rain,"42182099999,42176099999,VIDP,42139099999,42181099999,VIDD"
new delhi,04-09-2020,94.7,82.4,87.1,115.9,90.8,101.6,79.1,77.5,0.038,100,4.17,rain,0,0,19.2,6.9,113.7,1006.1,61.5,1.7,213.5,18.4,7,,2020-09-04T06:00:46,2020-09-04T18:39:05,0.57,"Rain, Partially cloudy",Partly cloudy throughout the day with afternoon rain.,rain,"42182099999,42176099999,VIDP,42139099999,42181099999,VIDD"
new delhi,05-09-2020,98.3,75.7,85,116.7,75.7,94.7,78,81.6,0.716,100,12.5,rain,0,0,28.9,12,256.5,1004.4,68.2,1.8,169.3,14.5,8,,2020-09-05T06:01:15,2020-09-05T18:37:55,0.6,"Rain, Partially cloudy",Partly cloudy throughout the day with rain.,rain,"42182099999,42176099999,VIDP,42139099999,42181099999,VIDD"
new delhi,06-09-2020,94.7,77,84.6,111.8,77,93.4,77.5,80.8,0,0,0,,0,0,11.4,5.8,252.1,1003.5,58.9,1.8,192.2,16.6,7,,2020-09-06T06:01:45,2020-09-06T18:36:45,0.63,Partially cloudy,Partly cloudy throughout the day.,partly-cloudy-day,"42182099999,42176099999,VIDP,42139099999,42181099999,VIDD"
new delhi,07-09-2020,92.9,80.6,84.7,112.4,87.1,96.3,78.5,82.2,0.083,100,4.17,rain,0,0,12.3,11,234,1003.9,55.7,1.7,220.5,19.1,8,,2020-09-07T06:02:14,2020-09-07T18:35:35,0.67,"Rain, Partially cloudy",Partly cloudy throughout the day with afternoon rain.,rain,"42182099999,42176099999,VIDP,42139099999,42181099999,VIDD"
new delhi,08-09-2020,94.9,78.8,86.2,110.2,78.8,96,77.1,75.7,0,0,0,,0,0,13.6,6.9,270.4,1004.6,49.6,1.7,213.7,18.3,8,,2020-09-08T06:02:43,2020-09-08T18:34:24,0.7,Partially cloudy,Partly cloudy throughout the day.,partly-cloudy-day,"42182099999,42176099999,VIDP,42139099999,42181099999,VIDD"
new delhi,09-09-2020,95.3,81.4,87.8,110.4,89.6,99.8,77.4,72.6,0,0,0,,0,0,13.9,9.2,283.1,1004.3,39.9,1.8,221.4,19.1,8,,2020-09-09T06:03:13,2020-09-09T18:33:14,0.73,Partially cloudy,Becoming cloudy in the afternoon.,partly-cloudy-day,"42182099999,42176099999,VIDP,42139099999,42181099999"
new delhi,10-09-2020,95,80.6,87.7,109.4,88.1,99,77.1,72.8,0,0,0,,0,0,16.3,9.2,277.5,1002.2,40,1.6,230.2,19.9,8,,2020-09-10T06:03:42,2020-09-10T18:32:03,0.75,Partially cloudy,Partly cloudy throughout the day.,partly-cloudy-day,"42182099999,42176099999,VIDP,42139099999,42181099999"
new delhi,11-09-2020,98.8,80.6,88.8,110,87.1,97.6,74.5,65.2,0,0,0,,0,0,14.8,8.1,296.3,1002.6,34.6,2,227.7,19.8,7,,2020-09-11T06:04:11,2020-09-11T18:30:51,0.8,Partially cloudy,Partly cloudy throughout the day.,partly-cloudy-day,"42182099999,42176099999,VIDP,42139099999,42181099999"
new delhi,12-09-2020,98.4,80.6,89.3,114.2,86.1,100.6,76.3,67.2,0,0,0,,0,0,11,4.7,339.9,1004.9,26,2,238.8,20.6,8,,2020-09-12T06:04:40,2020-09-12T18:29:40,0.83,Partially cloudy,Partly cloudy throughout the day.,partly-cloudy-day,"42182099999,42176099999,VIDP,42139099999,42181099999,VIDD"
new delhi,13-09-2020,96.7,82.4,89.6,112.3,90.8,103.1,77.6,68.9,0,0,0,,0,0,11.2,5.8,349.2,1004.8,45,1.7,225.9,19.6,7,,2020-09-13T06:05:10,2020-09-13T18:28:28,0.86,Partially cloudy,Partly cloudy throughout the day.,partly-cloudy-day,"42182099999,42176099999,VIDP,42139099999,42181099999,VIDD"
new delhi,14-09-2020,98.3,82.4,89.1,116.4,92.4,103,78.2,71.4,0,0,0,,0,0,13.6,5.8,320.7,1003.8,43.4,1.7,222.3,19.4,8,,2020-09-14T06:05:39,2020-09-14T18:27:16,0.9,Partially cloudy,Partly cloudy throughout the day.,partly-cloudy-day,"42182099999,42176099999,VIDP,42139099999,42181099999,VIDD"
new delhi,15-09-2020,98.4,78.8,89.1,111.9,78.8,101.3,77.2,69.6,0,0,0,,0,0,12.1,6.1,266,1003.3,44.7,1.8,242.1,20.9,8,,2020-09-15T06:06:08,2020-09-15T18:26:04,0.93,Partially cloudy,Partly cloudy throughout the day.,partly-cloudy-day,"42182099999,42176099999,VIDP,42139099999,42181099999,VIDD"
new delhi,16-09-2020,100.1,82.9,90.5,114.3,93.7,102.9,76.6,65.5,0,0,0,,0,0,13,6.9,268.3,1003,42.7,2.1,226.5,19.5,8,,2020-09-16T06:06:38,2020-09-16T18:24:52,0.96,Partially cloudy,Partly cloudy throughout the day.,partly-cloudy-day,"42182099999,42176099999,VIDP,42139099999,42181099999,VIDD"
new delhi,17-09-2020,98.4,82.4,90.6,113.8,90.8,102.1,76,63.8,0,0,0,,0,0,22.6,12.8,270.3,1002.7,32.3,2,239.4,20.6,8,,2020-09-17T06:07:07,2020-09-17T18:23:40,0,Partially cloudy,Partly cloudy throughout the day.,partly-cloudy-day,"42182099999,42176099999,VIDP,42139099999,42181099999,VIDD"
new delhi,18-09-2020,100.2,82.4,91.2,114,89.4,103.9,76.6,63.8,0,0,0,,0,0,22.1,10.3,272.5,1001.7,36.6,2,219.4,19.1,8,,2020-09-18T06:07:36,2020-09-18T18:22:28,0.03,Partially cloudy,Partly cloudy throughout the day.,partly-cloudy-day,"42182099999,42176099999,VIDP,42139099999,42181099999,VIDD"
new delhi,19-09-2020,98.4,82.4,90.1,112.1,90.8,102.5,76.9,66.9,0,0,0,,0,0,13,5.9,295.4,1002,38.7,2.1,229.1,19.9,8,,2020-09-19T06:08:06,2020-09-19T18:21:16,0.06,Partially cloudy,Partly cloudy throughout the day.,partly-cloudy-day,"42182099999,42176099999,VIDP,42139099999,42181099999,VIDD"
new delhi,20-09-2020,98.3,82.4,90,114.2,90.8,102.3,76.7,66.8,0,0,0,,0,0,16.3,6.1,299.9,1001.5,34.4,2.1,246.2,21.1,8,,2020-09-20T06:08:35,2020-09-20T18:20:03,0.1,Partially cloudy,Partly cloudy throughout the day.,partly-cloudy-day,"42182099999,42176099999,VIDP,42139099999,42181099999,VIDD"
new delhi,21-09-2020,98.3,82.4,90.1,114.3,89.4,102.9,76.9,66.1,0,0,0,,0,0,11,5.9,317.6,1000.4,38.1,1.8,231.4,20,8,,2020-09-21T06:09:05,2020-09-21T18:18:51,0.13,Partially cloudy,Partly cloudy throughout the day.,partly-cloudy-day,"42182099999,42176099999,VIDP,42139099999,42181099999,VIDD"
new delhi,22-09-2020,98.2,83.9,89.5,116.9,94.1,103.2,77.8,69.5,0,0,0,,0,0,19.9,8.2,92.2,1000.7,51,1.9,196.1,17,8,,2020-09-22T06:09:35,2020-09-22T18:17:39,0.17,Partially cloudy,Partly cloudy throughout the day.,partly-cloudy-day,"42182099999,42176099999,VIDP,42139099999,42181099999,VIDD"
new delhi,23-09-2020,96.5,83.6,89.3,114,93.4,102.3,77.4,69.1,0,0,0,,0,0,12.5,6.7,92.9,1000.9,46.6,2.2,219.4,19,8,,2020-09-23T06:10:05,2020-09-23T18:16:27,0.2,Partially cloudy,Partly cloudy throughout the day.,partly-cloudy-day,"42182099999,42176099999,VIDP,42139099999,42181099999,VIDD"
new delhi,24-09-2020,95.2,80.6,87,110,86.1,97.2,76.2,71.3,0,0,0,,0,0,11.9,8.1,99.7,1003,53,2.1,225.6,19.5,8,,2020-09-24T06:10:35,2020-09-24T18:15:15,0.25,Partially cloudy,Partly cloudy throughout the day.,partly-cloudy-day,"42182099999,42176099999,VIDP,42139099999,42181099999,VIDD"
new delhi,25-09-2020,98.5,80.8,88.2,105.7,86.2,95.5,73,63.2,0,0,0,,0,0,19.5,9.2,242,1002.6,29.5,2.1,244.1,21.1,8,,2020-09-25T06:11:05,2020-09-25T18:14:03,0.27,Partially cloudy,Partly cloudy throughout the day.,partly-cloudy-day,"42182099999,42176099999,VIDP,42139099999,42181099999,VIDD"
new delhi,26-09-2020,92.9,78.6,84.9,98.8,78.6,89.2,71.4,65.6,0,0,0,,0,0,20.1,11.3,255.5,1002.6,51.1,1.8,221.1,19.1,8,,2020-09-26T06:11:35,2020-09-26T18:12:52,0.31,Partially cloudy,Partly cloudy throughout the day.,partly-cloudy-day,"42182099999,42176099999,VIDP,42139099999,42181099999,VIDD"
new delhi,27-09-2020,96.6,75.2,84.9,103.8,75.2,88,68.5,59.7,0,0,0,,0,0,15.2,9.8,265.8,1005.4,33.3,2.3,238.8,20.6,8,,2020-09-27T06:12:06,2020-09-27T18:11:40,0.34,Partially cloudy,Partly cloudy throughout the day.,partly-cloudy-day,"42182099999,42176099999,VIDP,42139099999,42181099999,VIDD"
new delhi,28-09-2020,96.6,76.1,86,101.1,76.1,89,69.2,59.8,0,0,0,,0,0,23,9.4,287.8,1006.5,12.2,2.2,244,21.2,8,,2020-09-28T06:12:37,2020-09-28T18:10:29,0.37,Clear,Clear conditions throughout the day.,clear-day,"42182099999,42176099999,VIDP,42139099999,42181099999,VIDD"
new delhi,29-09-2020,96.7,75.5,85.6,104.3,75.5,89.5,70.4,62.4,0,0,0,,0,0,23,9.4,278.6,1006.2,15.1,2.2,235.8,20.4,8,,2020-09-29T06:13:07,2020-09-29T18:09:18,0.41,Clear,Clear conditions throughout the day.,clear-day,"42182099999,42176099999,VIDP,42139099999,42181099999,VIDD"
new delhi,30-09-2020,95,73.4,84.3,97.9,73.4,86.1,67.6,60.4,0,0,0,,0,0,23,10.3,268.3,1005.1,0.3,2.1,244.1,21.2,8,,2020-09-30T06:13:39,2020-09-30T18:08:08,0.44,Clear,Clear conditions throughout the day.,clear-day,"42182099999,42176099999,VIDP,42139099999,42181099999,VIDD"
new delhi,01-10-2020,98.4,73.4,84.7,100.9,73.4,86.5,67,58.4,0,0,0,,0,0,20.6,9.3,277.5,1004.6,3.6,1.9,242.3,20.9,8,,2020-10-01T06:14:10,2020-10-01T18:06:58,0.48,Clear,Clear conditions throughout the day.,clear-day,"42182099999,42176099999,VIDP,42139099999,42181099999,VIDD"
new delhi,02-10-2020,96.6,72.3,84.4,102.6,72.3,86.9,68.2,60.6,0,0,0,,0,0,15.2,9.8,267.4,1005.3,0,2.1,244.1,21,8,,2020-10-02T06:14:42,2020-10-02T18:05:48,0.5,Clear,Clear conditions throughout the day.,clear-day,"42182099999,42176099999,VIDP,42139099999,42181099999,VIDD"
new delhi,03-10-2020,96.6,71.8,83.8,98.5,71.8,84.8,65.4,57.7,0,0,0,,0,0,14.3,8.1,269.4,1006.4,0,2.1,243.4,20.8,8,,2020-10-03T06:15:13,2020-10-03T18:04:38,0.55,Clear,Clear conditions throughout the day.,clear-day,"42182099999,42176099999,VIDP,42139099999,42181099999,VIDD"
new delhi,04-10-2020,94.8,69.3,81.3,95.7,69.3,81.8,63.3,57.8,0,0,0,,0,0,17.2,8.1,292.1,1007.4,1.3,2,244,21,8,,2020-10-04T06:15:46,2020-10-04T18:03:29,0.58,Clear,Clear conditions throughout the day.,clear-day,"42182099999,42176099999,VIDP,42139099999,42181099999,VIDD"
new delhi,05-10-2020,95,69.8,81.7,98.6,69.8,82.6,63.2,56.6,0,0,0,,0,0,25.3,13.9,287.3,1007,0,2.3,243.5,20.9,8,,2020-10-05T06:16:18,2020-10-05T18:02:20,0.61,Clear,Clear conditions throughout the day.,clear-day,"42182099999,42176099999,VIDP,42139099999,42181099999,VIDD"
new delhi,06-10-2020,96.7,68.3,82.3,100.1,68.3,83.5,64.1,56.7,0,0,0,,0,0,19,9.2,261.8,1007.3,0,2,241.9,20.8,8,,2020-10-06T06:16:51,2020-10-06T18:01:12,0.65,Clear,Clear conditions throughout the day.,clear-day,"42182099999,42176099999,VIDP,42139099999,42181099999,VIDD"
new delhi,07-10-2020,96.6,68.6,82.5,102.6,68.6,83.6,64,57.3,0,0,0,,0,0,16.6,10.3,297.3,1009.2,1.3,2.2,239.2,20.7,8,,2020-10-07T06:17:24,2020-10-07T18:00:04,0.68,Clear,Clear conditions throughout the day.,clear-day,"42182099999,42176099999,VIDP,42139099999,42181099999,VIDD"
new delhi,08-10-2020,96.6,69.6,82.3,100.8,69.6,84.1,65.9,60.2,0,0,0,,0,0,16.8,6.1,277.9,1009.6,0.2,1.7,237.7,20.5,8,,2020-10-08T06:17:57,2020-10-08T17:58:57,0.71,Clear,Clear conditions throughout the day.,clear-day,"42182099999,42176099999,VIDP,42139099999,42181099999,VIDD"
new delhi,09-10-2020,94.8,69.3,81.9,103.3,69.3,83.8,65.4,59.8,0,0,0,,0,0,13.4,4.7,290.7,1009.7,0,1.8,234.1,20.1,8,,2020-10-09T06:18:31,2020-10-09T17:57:50,0.75,Clear,Clear conditions throughout the day.,clear-day,"42182099999,42176099999,VIDP,42139099999,42181099999,VIDD"
new delhi,10-10-2020,94.7,69.8,82.4,98.3,69.8,84.3,65.9,59.6,0,0,0,,0,0,17.2,8.1,261.6,1008.4,0.3,1.7,228.5,19.7,8,,2020-10-10T06:19:05,2020-10-10T17:56:44,0.75,Clear,Clear conditions throughout the day.,clear-day,"42182099999,42176099999,VIDP,42139099999,42181099999,VIDD"
new delhi,11-10-2020,95.1,71.1,81.7,96.9,71.1,82.4,64.5,58.6,0,0,0,,0,0,18.6,9.2,270.5,1006.5,16.4,2.1,229.9,20,8,,2020-10-11T06:19:39,2020-10-11T17:55:38,0.81,Clear,Clear conditions throughout the day.,clear-day,"42182099999,42176099999,VIDP,42139099999,42181099999,VIDD"
new delhi,12-10-2020,94.8,70,80.7,97.5,70,81.6,64.5,60.8,0,0,0,,0,0,12.5,3.4,299.2,1005,3,1.6,227.2,19.6,8,,2020-10-12T06:20:14,2020-10-12T17:54:33,0.85,Clear,Clear conditions throughout the day.,clear-day,"42182099999,42176099999,VIDP,42139099999,42181099999,VIDD"
new delhi,13-10-2020,94.7,70.6,81.8,105.2,70.6,85.5,69.2,67.1,0,0,0,,0,0,14.5,4.7,88.5,1005.9,16.2,1.6,214.5,18.6,7,,2020-10-13T06:20:49,2020-10-13T17:53:29,0.88,Clear,Clear conditions throughout the day.,clear-day,"42182099999,42176099999,VIDP,42139099999,42181099999,VIDD"
new delhi,14-10-2020,93.3,76.6,84,101.8,76.6,88,71.3,67.4,0,0,0,,0,0,11,4.7,27.6,1007.3,42.8,1.3,183.5,15.8,7,,2020-10-14T06:21:24,2020-10-14T17:52:25,0.91,Partially cloudy,Partly cloudy throughout the day.,partly-cloudy-day,"42182099999,42176099999,VIDP,42139099999,42181099999,VIDD"
new delhi,15-10-2020,94.4,70.9,82.2,95.2,70.9,82.4,62.5,54.5,0,0,0,,0,0,14.8,4.8,325,1008,22.5,1.7,215.9,18.7,7,,2020-10-15T06:22:00,2020-10-15T17:51:22,0.95,Partially cloudy,Partly cloudy throughout the day.,partly-cloudy-day,"42182099999,42176099999,VIDP,42139099999,42181099999,VIDD"
new delhi,16-10-2020,93,66.2,79.6,91.7,66.2,79.1,57.1,49.4,0,0,0,,0,0,13,4.7,279.5,1007.9,0,1.7,225.7,19.4,8,,2020-10-16T06:22:36,2020-10-16T17:50:20,0.98,Clear,Clear conditions throughout the day.,clear-day,"42182099999,42176099999,VIDP,42139099999,42181099999,VIDD"
new delhi,17-10-2020,94.5,65.8,77.9,95.9,65.8,78,59.8,56.8,0,0,0,,0,0,10.7,3.4,333.2,1008.6,4.8,1.7,219.6,19.2,8,,2020-10-17T06:23:13,2020-10-17T17:49:19,0,Clear,Clear conditions throughout the day.,clear-day,"42182099999,42176099999,VIDP,42139099999,42181099999,VIDD"
new delhi,18-10-2020,94.2,65.4,78.9,91.8,65.4,78.5,57.2,51.2,0,0,0,,0,0,17,8.1,262.4,1008.5,3.5,1.6,221.3,19.2,8,,2020-10-18T06:23:50,2020-10-18T17:48:18,0.05,Clear,Clear conditions throughout the day.,clear-day,"42182099999,42176099999,VIDP,42139099999,42181099999,VIDD"
new delhi,19-10-2020,92.2,63.1,78,91.9,63.1,77.5,56.9,51.5,0,0,0,,0,0,16.8,10.3,290,1008.4,10.5,1.7,216,18.6,8,,2020-10-19T06:24:28,2020-10-19T17:47:18,0.08,Clear,Clear conditions throughout the day.,clear-day,"42182099999,42176099999,VIDP,42139099999,42181099999,VIDD,42183099999"
new delhi,20-10-2020,93,61.1,76.1,91.9,61.1,75.6,55,52.1,0,0,0,,0,0,17.7,5,301.9,1007.9,0,1.8,226.5,19.6,8,,2020-10-20T06:25:06,2020-10-20T17:46:19,0.12,Clear,Clear conditions throughout the day.,clear-day,"42182099999,42176099999,VIDP,42139099999,42181099999,VIDD"
new delhi,21-10-2020,94.7,62.2,77,92.3,62.2,76.4,56.9,54.8,0,0,0,,0,0,15.4,4.7,295.3,1009,7.5,1.8,200.8,17.3,8,,2020-10-21T06:25:44,2020-10-21T17:45:21,0.15,Clear,Clear conditions throughout the day.,clear-day,"42182099999,42176099999,VIDP,42139099999,42181099999,VIDD"
new delhi,22-10-2020,91.2,66.7,77.1,89.9,66.7,77.1,58.9,55.9,0,0,0,,0,0,11.4,3.5,351,1007.8,59.5,1.4,190.1,16.4,8,,2020-10-22T06:26:23,2020-10-22T17:44:24,0.18,Partially cloudy,Partly cloudy throughout the day.,partly-cloudy-day,"42182099999,42176099999,VIDP,42139099999,42181099999,VIDD"
new delhi,23-10-2020,92.4,61.3,75.9,91.9,61.3,76,58.5,58.5,0,0,0,,0,0,12.1,3.5,342.1,1007.4,37.7,1.2,213.9,18.3,8,,2020-10-23T06:27:02,2020-10-23T17:43:28,0.25,Partially cloudy,Partly cloudy throughout the day.,partly-cloudy-day,"42182099999,42176099999,VIDP,42139099999,42181099999,VIDD"
new delhi,24-10-2020,91.1,61.6,75.1,89.3,61.6,74.7,55.6,54.7,0,0,0,,0,0,17.2,8.1,259.3,1008.5,3.6,1.3,217.4,18.8,8,,2020-10-24T06:27:41,2020-10-24T17:42:33,0.25,Clear,Clear conditions throughout the day.,clear-day,"42182099999,42176099999,VIDP,42139099999,42181099999,VIDD"
new delhi,25-10-2020,91.3,60.6,74.6,95.4,60.6,75.2,59.7,62.5,0,0,0,,0,0,14.1,4.7,224.8,1010.9,0.1,1.3,214.4,18.5,8,,2020-10-25T06:28:22,2020-10-25T17:41:39,0.29,Clear,Clear conditions throughout the day.,clear-day,"42182099999,42176099999,VIDP,42139099999,42181099999,VIDD"
new delhi,26-10-2020,91.2,62.4,74.9,90.8,62.4,74.8,57.4,57.7,0,0,0,,0,0,12.1,4.8,289.5,1012.2,28.3,1.3,172.8,14.9,6,,2020-10-26T06:29:02,2020-10-26T17:40:46,0.32,Partially cloudy,Partly cloudy throughout the day.,partly-cloudy-day,"42182099999,42176099999,VIDP,42139099999,42181099999,VIDD"
new delhi,27-10-2020,88,61.5,73.9,86.9,61.5,73.7,56.2,56.5,0,0,0,,0,0,17.2,10,260.5,1012.2,0,1.3,213.2,18.3,8,,2020-10-27T06:29:43,2020-10-27T17:39:54,0.35,Clear,Clear conditions throughout the day.,clear-day,"42182099999,42176099999,VIDP,42139099999,42181099999,VIDD"
new delhi,28-10-2020,87.6,57.6,72,85.7,57.6,71.7,54.9,57.8,0,0,0,,0,0,12.3,4.7,296.2,1012.9,0,1.2,213,18.3,8,,2020-10-28T06:30:24,2020-10-28T17:39:03,0.39,Clear,Clear conditions throughout the day.,clear-day,"42182099999,42176099999,VIDP,42139099999,42181099999,VIDD"
new delhi,29-10-2020,87.6,58.1,71,85.5,58.1,70.6,53.5,58.8,0,0,0,,0,0,10.5,3.4,318.6,1013.9,0,1,209,18.1,8,,2020-10-29T06:31:06,2020-10-29T17:38:13,0.42,Clear,Clear conditions throughout the day.,clear-day,"42182099999,42176099999,VIDP,42139099999,42181099999"
new delhi,30-10-2020,87.7,59,72,85.5,59,71.5,53.9,57.5,0,0,0,,0,0,18.1,6.9,297.7,1013.5,0,1.2,207.7,18.1,8,,2020-10-30T06:31:48,2020-10-30T17:37:24,0.45,Clear,Clear conditions throughout the day.,clear-day,"42182099999,42176099999,VIDP,42139099999,42181099999"
new delhi,31-10-2020,87.6,59.2,72,85.8,59.2,71.6,54.5,57.5,0,0,0,,0,0,19.7,9.3,259,1013.4,0,1.1,208.5,18.1,8,,2020-10-31T06:32:31,2020-10-31T17:36:37,0.5,Clear,Clear conditions throughout the day.,clear-day,"42182099999,42176099999,VIDP,42139099999,42181099999,VIDD"
new delhi,01-11-2020,86,54,70.2,84.3,54,69.9,51.9,55,0,0,0,,0,0,20.4,8.4,257.6,1014.1,0,1.1,209.2,18.2,8,,2020-11-01T06:33:14,2020-11-01T17:35:50,0.52,Clear,Clear conditions throughout the day.,clear-day,"42182099999,42176099999,VIDP,42139099999,42181099999,VIDD"
new delhi,02-11-2020,85.5,55.4,68.2,83.9,55.4,67.9,49.6,56.1,0,0,0,,0,0,19.2,8.1,271.4,1014.8,0,1.4,208.4,18.1,8,,2020-11-02T06:33:58,2020-11-02T17:35:05,0.56,Clear,Clear conditions throughout the day.,clear-day,"42182099999,42176099999,VIDP,42139099999,42181099999,VIDD"
new delhi,03-11-2020,85.8,54.1,68,83.8,54.1,67.6,51.8,60.2,0,0,0,,0,0,12.3,8.1,263,1014.3,0,1.4,206.2,18,8,,2020-11-03T06:34:42,2020-11-03T17:34:22,0.59,Clear,Clear conditions throughout the day.,clear-day,"42182099999,42176099999,VIDP,42139099999,42181099999"
new delhi,04-11-2020,81.9,55,67.3,81.3,55,67.2,52.3,61.3,0,0,0,,0,0,17.9,5.9,254.1,1012.9,0,0.9,198,17.1,7,,2020-11-04T06:35:26,2020-11-04T17:33:39,0.63,Clear,Clear conditions throughout the day.,fog,"42182099999,42176099999,VIDP,42139099999,42181099999,VIDD"
new delhi,05-11-2020,86.6,56.1,68.7,85.4,56.1,68.3,51.9,60.1,0,0,0,,0,0,12.8,6.7,264.4,1014.2,4.2,0.8,200,17.1,7,,2020-11-05T06:36:11,2020-11-05T17:32:58,0.66,Clear,Clear conditions throughout the day.,fog,"42182099999,42176099999,VIDP,42139099999,42181099999"
new delhi,06-11-2020,86.7,56.5,67.9,85.8,56.5,67.7,52.2,61.1,0,0,0,,0,0,16.1,5.6,269.9,1017.1,0,0.9,198.7,17.1,7,,2020-11-06T06:36:56,2020-11-06T17:32:18,0.69,Clear,Clear conditions throughout the day.,fog,"42182099999,42176099999,VIDP,42139099999,42181099999"
new delhi,07-11-2020,83.3,55.8,68.8,82.4,55.8,68.5,52.8,60.6,0,0,0,,0,0,19,10.3,282.7,1018,0,0.8,198.1,17.1,7,,2020-11-07T06:37:41,2020-11-07T17:31:39,0.73,Clear,Clear conditions throughout the day.,fog,"42182099999,42176099999,VIDP,42139099999,42181099999"
new delhi,08-11-2020,83,55.4,67.1,82.7,55.4,67,53.3,65.4,0,0,0,,0,0,13,4.7,282.7,1018.5,0,0.6,197.2,17.1,7,,2020-11-08T06:38:27,2020-11-08T17:31:02,0.75,Clear,Clear conditions throughout the day.,fog,"42182099999,42176099999,VIDP,42139099999,42181099999"
new delhi,09-11-2020,81.9,54.3,65.9,82.2,54.3,65.9,54.9,71.7,0,0,0,,0,0,15.9,4.7,281.5,1017,4.2,0.5,194.7,16.9,7,,2020-11-09T06:39:13,2020-11-09T17:30:26,0.8,Clear,Clear conditions throughout the day.,fog,"42182099999,42176099999,VIDP,42139099999,42181099999"
new delhi,10-11-2020,83.6,55,66.1,83.8,55,66.1,55.7,72.3,0,0,0,,0,0,14.8,5.8,89.6,1015.7,8.1,0.5,190.4,16.4,7,,2020-11-10T06:39:59,2020-11-10T17:29:52,0.83,Clear,Clear conditions throughout the day.,fog,"42182099999,42176099999,VIDP,42139099999,42181099999"
new delhi,11-11-2020,83.8,56.2,67.6,84.3,56.2,67.6,55.7,68.9,0,0,0,,0,0,15,6.9,69.8,1017.6,1.2,1.1,182.8,15.9,7,,2020-11-11T06:40:46,2020-11-11T17:29:19,0.86,Clear,Clear conditions throughout the day.,clear-day,"42182099999,42176099999,VIDP,42139099999,42181099999,remote"
new delhi,12-11-2020,82.8,56.1,68.5,82.7,56.1,68.4,55.8,67.7,0,0,0,,0,0,10.7,4.7,44.3,1018.9,3.8,1.2,181.2,15.5,7,,2020-11-12T06:41:33,2020-11-12T17:28:48,0.9,Clear,Clear conditions throughout the day.,clear-day,"42182099999,42176099999,VIDP,42139099999,42181099999"
new delhi,13-11-2020,85.1,57.2,68.4,84.1,57.2,68.2,55.8,68.5,0,0,0,,0,0,11.4,4.5,234.5,1017.4,0.2,1.1,185.3,16,7,,2020-11-13T06:42:20,2020-11-13T17:28:18,0.93,Clear,Clear conditions throughout the day.,clear-day,"42182099999,42176099999,VIDP,42139099999,42181099999,VIDD"
new delhi,14-11-2020,82.2,54.5,66.5,83.4,54.5,66.7,57,73.5,0,0,0,,0,0,10.3,3.4,25.9,1015.2,3.9,0.7,184.7,16,7,,2020-11-14T06:43:07,2020-11-14T17:27:49,0.97,Clear,Clear conditions throughout the day.,fog,"42182099999,42176099999,VIDP,42139099999,42181099999,VIDD"
new delhi,15-11-2020,84,56.1,68.5,83.5,56.1,68.5,57.7,70.9,0.02,100,4.17,rain,0,0,19.7,9.2,100.3,1014.4,36.1,0.7,150.5,13,6,,2020-11-15T06:43:55,2020-11-15T17:27:22,0,"Rain, Partially cloudy",Becoming cloudy in the afternoon with afternoon rain.,rain,"42182099999,42176099999,VIDP,42139099999,42181099999,VIDD"
new delhi,16-11-2020,76.9,63.8,69,76.9,63.8,69,62.3,79.7,0,0,0,,0,0,14.8,9.3,85.5,1016.2,68.1,1.4,92,7.9,5,,2020-11-16T06:44:43,2020-11-16T17:26:57,0.03,Partially cloudy,Partly cloudy throughout the day.,partly-cloudy-day,"42182099999,42176099999,VIDP,42139099999,42181099999,VIDD"
new delhi,17-11-2020,78.2,57.2,67,78.2,57.2,67,57,72.6,0,0,0,,0,0,15.4,8.1,280.8,1014.9,32.2,1.5,159.7,13.9,6,,2020-11-17T06:45:31,2020-11-17T17:26:33,0.07,Partially cloudy,Partly cloudy throughout the day.,partly-cloudy-day,"42182099999,42176099999,VIDP,42139099999,42181099999"
new delhi,18-11-2020,76.5,55.5,64,76.5,55.5,64,52.9,69.5,0,0,0,,0,0,13.6,5.8,283,1013.7,9.3,1.3,182.2,15.8,7,,2020-11-18T06:46:19,2020-11-18T17:26:11,0.1,Clear,Clear conditions throughout the day.,clear-day,"42182099999,42176099999,VIDP,42139099999,42181099999"
new delhi,19-11-2020,77.1,52.9,63.1,77.1,52.9,63.1,50.2,65.9,0,0,0,,0,0,14.3,5.8,285.5,1014.1,9.2,1.3,174.5,15,7,,2020-11-19T06:47:07,2020-11-19T17:25:50,0.13,Clear,Clear conditions throughout the day.,clear-day,"42182099999,42176099999,VIDP,42139099999,42181099999"
new delhi,20-11-2020,76.7,50.4,62.5,76.7,50.4,62.5,48.8,64.1,0,0,0,,0,0,20.6,10.3,289.8,1015.6,0,1.3,182.9,15.8,7,,2020-11-20T06:47:55,2020-11-20T17:25:31,0.17,Clear,Clear conditions throughout the day.,clear-day,"42182099999,42176099999,VIDP,42139099999,42181099999"
new delhi,21-11-2020,75.4,48.2,61,75.4,46.3,60.9,46.6,63.6,0,0,0,,0,0,25.7,11.4,278.4,1016,0,1.3,184,16.1,7,,2020-11-21T06:48:43,2020-11-21T17:25:13,0.2,Clear,Clear conditions throughout the day.,clear-day,"42182099999,42176099999,VIDP,42139099999,42181099999"
new delhi,22-11-2020,74.9,48.8,59.5,74.9,48.8,59.5,44.4,61.3,0,0,0,,0,0,19,9,287.1,1016.7,17.8,1.4,181.3,15.7,7,,2020-11-22T06:49:31,2020-11-22T17:24:57,0.25,Clear,Clear conditions throughout the day.,clear-day,"42182099999,42176099999,VIDP,42139099999,42181099999"
new delhi,23-11-2020,76.7,47.5,60.4,76.7,47.5,60.4,46.1,63.6,0,0,0,,0,0,8.5,4.9,3.1,1017,24.7,1.1,177.8,15.4,7,,2020-11-23T06:50:20,2020-11-23T17:24:43,0.27,Partially cloudy,Becoming cloudy in the afternoon.,partly-cloudy-day,"42182099999,42176099999,VIDP,42139099999,42181099999,remote"
new delhi,24-11-2020,75.7,48.5,61.3,75.7,48.5,61.3,47,63.1,0,0,0,,0,0,10.5,5.8,176.1,1016.5,51.1,1,162.6,14.2,7,,2020-11-24T06:51:08,2020-11-24T17:24:30,0.3,Partially cloudy,Partly cloudy throughout the day.,partly-cloudy-day,"42182099999,42176099999,VIDP,42139099999,42181099999"
new delhi,25-11-2020,73.4,51.4,63.3,73.4,51.4,63.3,50.7,65.9,0,0,0,,0,0,15,6.9,69.1,1016.7,70.4,0.7,135.7,11.6,5,,2020-11-25T06:51:56,2020-11-25T17:24:19,0.33,Partially cloudy,Partly cloudy throughout the day.,fog,"42182099999,42176099999,VIDP,42139099999,42181099999"
new delhi,26-11-2020,76.7,58.7,66.6,76.7,58.7,66.6,53.8,65.7,0,0,0,,0,0,13.9,6.9,333.2,1018.9,54.5,1.4,148.1,12.8,6,,2020-11-26T06:52:44,2020-11-26T17:24:10,0.36,Partially cloudy,Partly cloudy throughout the day.,partly-cloudy-day,"42182099999,42176099999,VIDP,42139099999,42181099999,VIDD"
new delhi,27-11-2020,79.3,53.6,64,79.3,53.6,64,51.6,67.3,0,0,0,,0,0,19.7,9.4,269.1,1020.6,0,1.7,174.9,15.3,7,,2020-11-27T06:53:31,2020-11-27T17:24:02,0.4,Clear,Clear conditions throughout the day.,clear-day,"42182099999,42176099999,VIDP,42139099999,42181099999,VIDD,remote"
new delhi,28-11-2020,78.4,53.2,63.3,78.4,53.2,63.3,49.8,65.1,0,0,0,,0,0,17.2,10.3,273.2,1019.7,0,1.6,175.9,15.4,7,,2020-11-28T06:54:19,2020-11-28T17:23:56,0.43,Clear,Clear conditions throughout the day.,clear-day,"42182099999,42176099999,VIDP,42139099999,42181099999"
new delhi,29-11-2020,77.7,48.7,61.3,77.7,48.7,61.3,47.6,64.1,0,0,0,,0,0,13.2,4.9,283.6,1018.2,4.8,1.6,176.6,15.4,7,,2020-11-29T06:55:06,2020-11-29T17:23:52,0.46,Clear,Clear conditions throughout the day.,clear-day,"42182099999,42176099999,VIDP,42139099999,42181099999"
new delhi,30-11-2020,77.6,48.2,60.5,77.6,48.2,60.5,48.1,67.3,0,0,0,,0,0,13.4,6.6,275.6,1017.3,3.8,1.2,171.3,15,7,,2020-11-30T06:55:53,2020-11-30T17:23:49,0.5,Clear,Clear conditions throughout the day.,clear-day,"42182099999,42176099999,VIDP,42139099999,42181099999"
new delhi,01-12-2020,79.6,49.6,62.5,79.6,49.6,62.5,50.9,69.5,0,0,0,,0,0,12.1,4.9,272,1017.4,0,0.9,169.1,14.5,6,,2020-12-01T06:56:39,2020-12-01T17:23:48,0.53,Clear,Clear conditions throughout the day.,fog,"42182099999,42176099999,VIDP,42139099999,42181099999,VIDD"
new delhi,02-12-2020,79.5,50.7,63.4,79.5,50.7,63.4,50.4,66.5,0,0,0,,0,0,19,9.2,276.6,1015.4,0,1.1,170.5,14.8,7,,2020-12-02T06:57:25,2020-12-02T17:23:48,0.57,Clear,Clear conditions throughout the day.,clear-day,"42182099999,42176099999,VIDP,42139099999,42181099999,remote"
new delhi,03-12-2020,80.1,50,62.8,80.6,50,62.8,51,69.5,0,0,0,,0,0,12.3,5.8,255.9,1014.4,0,1,168.2,14.5,6,,2020-12-03T06:58:11,2020-12-03T17:23:50,0.6,Clear,Clear conditions throughout the day.,clear-day,"42182099999,42176099999,VIDP,42139099999,42181099999"
new delhi,04-12-2020,81.3,50.6,63.2,81.8,50.6,63.2,51.7,70.1,0,0,0,,0,0,10.7,5.8,118.5,1013,6.8,0.9,166,14.3,6,,2020-12-04T06:58:56,2020-12-04T17:23:54,0.64,Clear,Clear conditions throughout the day.,fog,"42182099999,42176099999,VIDP,42139099999,42181099999"
new delhi,05-12-2020,80.4,54.5,65.4,81.3,54.5,65.4,55.3,72.5,0,0,0,,0,0,16.3,10.3,103.3,1013,0,0.8,164,14.2,6,,2020-12-05T06:59:41,2020-12-05T17:23:59,0.67,Clear,Clear conditions throughout the day.,fog,"42182099999,42176099999,VIDP,42139099999,42181099999"
new delhi,06-12-2020,81.7,55.8,66.8,81.9,55.8,66.8,56.7,73.3,0,0,0,,0,0,12.3,5.8,138.2,1015.4,2.4,0.9,163.6,14.2,6,,2020-12-06T07:00:25,2020-12-06T17:24:06,0.71,Clear,Clear conditions throughout the day.,fog,"42182099999,42176099999,VIDP,42139099999,42181099999"
new delhi,07-12-2020,78.5,55.4,63.8,78.5,55.4,63.8,58.3,84.5,0,0,0,,0,0,17,6.9,262.2,1017.1,25,0.5,162.6,14.1,6,,2020-12-07T07:01:08,2020-12-07T17:24:15,0.74,Partially cloudy,Clearing in the afternoon.,fog,"42182099999,42176099999,VIDP,42139099999,42181099999"
new delhi,08-12-2020,80.4,53,64.1,80.8,53,64.2,54.4,74.5,0,0,0,,0,0,12.3,5.8,324.8,1017.2,0.2,0.8,162.3,14.2,6,,2020-12-08T07:01:51,2020-12-08T17:24:25,0.75,Clear,Clear conditions throughout the day.,fog,"42182099999,42176099999,VIDP,42139099999,42181099999,VIDD"
new delhi,09-12-2020,82.9,52.9,65.1,81.9,52.9,65,54.2,71.7,0,0,0,,0,0,11.2,5.8,287.3,1015.4,0.5,1.2,161.1,14,6,,2020-12-09T07:02:33,2020-12-09T17:24:37,0.81,Clear,Clear conditions throughout the day.,clear-day,"42182099999,42176099999,VIDP,42139099999,42181099999"
new delhi,10-12-2020,81.2,54.4,66.2,81.3,54.4,66.2,54.8,70.3,0,0,0,,0,0,12.1,4.7,274.8,1015,1.9,1.2,155.3,13.3,6,,2020-12-10T07:03:15,2020-12-10T17:24:50,0.85,Clear,Clear conditions throughout the day.,clear-day,"42182099999,42176099999,VIDP,42139099999,42181099999"
new delhi,11-12-2020,75.5,54.8,64.9,75.5,54.8,64.9,56.6,76.5,0,0,0,,0,0,12.1,8.1,155.8,1014.9,42.7,1,138.6,11.9,6,,2020-12-11T07:03:56,2020-12-11T17:25:05,0.88,Partially cloudy,Partly cloudy throughout the day.,partly-cloudy-day,"42182099999,42176099999,VIDP,42139099999,42181099999,remote"
